"DATUM_CODE","DATUM_NAME","DATUM_TYPE","ORIGIN_DESCRIPTION","REALIZATION_EPOCH","ELLIPSOID_CODE","PRIME_MERIDIAN_CODE","AREA_OF_USE_CODE","DATUM_SCOPE","REMARKS","INFORMATION_SOURCE","DATA_SOURCE","REVISION_DATE","CHANGE_ID","DEPRECATED","ESRI_DATUM_NAME"
6181,Luxembourg 1930,geodetic,"Fundamental point: northern station of Habay-la-Neuve baseline in Belgium. Latitude: 49°43'24.408""N, longitude: 5°38'22.470""E (of Greenwich).",1930,7022,8901,1146,"Geodetic survey, cadastre, topographic mapping, engineering survey.",,"Administration du Cadastre et de la Topographie via EuroGeographics; http://crs.bkg.bund.de/crs-eu/",OGP,"2008/06/24",2008.045,0,"D_Luxembourg_1930"
6182,Azores Occidental Islands 1939,geodetic,"Fundamental point: Observatario Meteorologico Flores.",1939,7022,8901,1344,Topographic mapping.,,"Instituto Geografico e Cadastral Lisbon via EuroGeographics; http://crs.bkg.bund.de/crs-eu/",OGP,"2005/12/30",2005.850,0,"D_Azores_Occidental_Islands_1939"
6183,Azores Central Islands 1948,geodetic,"Fundamental point: Graciosa south west base. Latitude: 39°03'54.934""N, longitude: 28°02'23.882""W (of Greenwich).",1948,7022,8901,1301,Topographic mapping.,"Replaced by 1995 adjustment (datum code 6665).","Instituto Geografico e Cadastral Lisbon via EuroGeographics; http://crs.bkg.bund.de/crs-eu/  Oil industry sources for origin description details.",OGP,"2008/06/24",2002.250 2003.231 2003.362 2008.045,0,"D_Azores_Central_Islands_1948"
6184,Azores Oriental Islands 1940,geodetic,"Fundamental point: Forte de São Bras.",1940,7022,8901,1345,Topographic mapping.,"Replaced by 1995 adjustment (datum code 6664).","Instituto Geografico e Cadastral Lisbon via EuroGeographics; http://crs.bkg.bund.de/crs-eu/",OGP,"2003/08/14",2003.231,0,"D_Azores_Oriental_Islands_1940"
6185,Madeira 1936,geodetic,"Fundamental point: Madeira SE Base.",1936,7022,8901,1314,Topographic mapping.,,"Instituto Geografico e Cadastral Lisbon via EuroGeographics; http://crs.bkg.bund.de/crs-eu/",OGP,"2001/06/05",,1,"D_Madeira_1936"
6188,OSNI 1952,geodetic,Position fixed to the coordinates from the 19th century Principle Triangulation of station Divis. Scale and orientation controlled by position of Principle Triangulation stations Knocklayd and Trostan.,1952,7001,8901,2530,Geodetic survey and topographic mapping.,"Replaced by Geodetic Datum of 1965 alias 1975 Mapping Adjustment or TM75 (datum code 6300).",Ordnance Survey of Northern Ireland.,OGP,"2001/11/06",,0,"D_OSNI_1952"
6189,Red Geodesica Venezolana,geodetic,Realised by a frame of 67 stations observed in 1995 as a densification of the SIRGAS campaign and adjusted in the ITRF94.,2000,7019,8901,1251,Geodetic survey.,,Servicio Autonomo de Geografia y Cartografia Nacional.,OGP,"2001/06/11",,0,"D_REGVEN"
6190,Posiciones Geodesicas Argentinas 1998,geodetic,"A geodetic network of 136 high accuracy surveyed points. Densification of SIRGAS 1995; ITRF94 at epoch 1995.42.",1998,7019,8901,1033,Geodetic survey.,"Technically, but not legally, this datum replaced the 1994 POSGAR adjustment (code 6694) until adoption of the 2007 POSGAR adjustment (code 1062) in May 2009.","Instituto Geográfico Militar de la República Argentina, http://www.igm.gov.ar",OGP,"2011/03/28",2003.361 2005.460 2005.480 2006.770 2009.028,0,"D_POSGAR_1998"
6191,Albanian 1987,geodetic,,1987,7024,8901,3212,"Geodetic survey, cadastre, topographic mapping, engineering survey.",,"EuroGeographics; http://crs.bkg.bund.de/crs-eu/",OGP,"2011/07/20",2011.062,0,"D_Albanian_1987"
6192,Douala 1948,geodetic,"South pillar of Douala base; 4°00'40.64""N, 9°42'30.41""E (of Greenwich).",1948,7022,8901,2555,Topographic mapping.,"Replaced  by Manoca 1962 datum (code 6193).",TotalFinaElf,OGP,"2008/06/24",2005.830 2008.045,0,"D_Douala_1948"
6193,Manoca 1962,geodetic,"Reservoir centre at the  Manoca tower (""tube Suel""), 3°51'49.896""N, 9°36'49.347""E (of Greenwich).",1962,7011,8901,2555,Topographic mapping.,"The intent of the Bukavu 1953 conference was to adopt the Clarke 1880 (RGS) ellipsoid (code 7012) but in practice this datum has used the IGN version.  Replaces Douala 1948 (code 6192).",TotalFinaElf,OGP,"2008/06/24",2008.045,0,"D_Manoca_1962"
6194,Qornoq 1927,geodetic,"Fundamental point: Station 7008. Latitude: 64°31'06.27""N, longitude: 51°12'24.86""W (of Greenwich).",1927,7022,8901,3362,Topographic mapping.,,"Kort & Matrikelstyrelsen, Copenhagen. Origin coordinates from NIMA http://earth-info.nima.mil/",OGP,"2008/06/24",2003.362 2005.460 2006.220 2008.045,0,"D_Qornoq_1927"
6195,Scoresbysund 1952,geodetic,,1952,7022,8901,2570,Topographic mapping.,,"Kort & Matrikelstyrelsen, Copenhagen.",OGP,"2002/01/18",,0,"D_Scoresbysund_1952"
6196,Ammassalik 1958,geodetic,,1958,7022,8901,2571,Topographic mapping.,,"Kort & Matrikelstyrelsen, Copenhagen.",OGP,"2002/01/18",,0,"D_Ammassalik_1958"
6197,Garoua,geodetic,"Fundamental point: IGN astronomical station and benchmark no. 16 at Tongo. Latitude 8°55'08.74""N, longitude 13°30'43.19""E (of Greenwich).",,7012,8901,2590,Topographic mapping.,,TotalFinaElf,OGP,"2008/06/24",2008.045,0,"D_Garoua"
6198,Kousseri,geodetic,"IGN astronomical station Dabanga; 11°55'05.9""N  14°38'40.8""E (of Greenwich).",,7012,8901,2591,Topographic mapping.,,TotalFinaElf,OGP,"2008/06/24",2008.045,0,"D_Kousseri"
6199,Egypt 1930,geodetic,"Fundamental point: Station F1 (Venus). Latitude: 30°01'42.86""N, longitude: 31°16'37.05""E (of Greenwich).",1930,7022,8901,3242,Used for scientific purposes only.,"Note that Egypt 1930 uses the International 1924 ellipsoid, unlike the Egypt 1907 datum (code 6229) which uses the Helmert ellipsoid. Oil industry references to the Egypt 1930 datum name and the Helmert ellipsoid probably mean Egypt 1907 datum.",,OGP,"2008/06/24",2008.045,0,"D_Egypt_1930"
6200,Pulkovo 1995,geodetic,"Fundamental point: Pulkovo observatory. Latitude: 59°46'15.359""N, longitude: 30°19'28.318""E (of Greenwich).",1995,7024,8901,1198,Scientific adjustment.,,"""Main Terms of Reference for the State Geodetic Network""; Federal Geodetic Service of Russia; 1994",OGP,"2008/06/24",2008.045,0,"D_Pulkovo_1995"
6201,Adindan,geodetic,"Fundamental point: Station 15; Adindan. Latitude: 22°10'07.110""N, longitude: 31°29'21.608""E (of Greenwich).",,7012,8901,1271,Topographic mapping.,"The 12th parallel traverse of 1966-70 (Point 58 datum, code 6620) is connected to the Adindan network in western Sudan. This has given rise to misconceptions that the Adindan network is used in west Africa.",,OGP,"2008/06/24",2002.431 2003.361 2008.045,0,"D_Adindan"
6202,Australian Geodetic Datum 1966,geodetic,"Fundamental point: Johnson Memorial Cairn. Latitude: 25°56'54.5515""S, longitude: 133°12'30.0771""E (of Greenwich).",1966,7003,8901,1279,Topographic mapping.,,"Australian Map Grid Technical Manual. National Mapping Council of Australia Technical Publication 7; 1972.",OGP,"2008/06/24",2003.361 2008.045,0,"D_Australian_1966"
6203,Australian Geodetic Datum 1984,geodetic,"Fundamental point: Johnson Memorial Cairn. Latitude: 25°56'54.5515""S, longitude: 133°12'30.0771""E (of Greenwich).",1984,7003,8901,2576,Topographic mapping.,"Uses all data from 1966 adjustment with additional observations, improved software and a geoid model.","""GDA technical manual v2_2"", Intergovernmental Committee on Surveying and Mapping. www.anzlic.org.au/icsm/gdtm/",OGP,"2008/06/24",2003.290 2003.361 2008.045,0,"D_Australian_1984"
6204,Ain el Abd 1970,geodetic,"Fundamental point: Ain El Abd.  Latitude: 28°14'06.171""N, longitude: 48°16'20.906""E (of Greenwich).",1970,7022,8901,1272,Topographic mapping.,,,OGP,"2008/06/24",2003.361 2008.045,0,"D_Ain_el_Abd_1970"
6205,Afgooye,geodetic,,,7024,8901,3308,Topographic mapping.,,,OGP,"2012/01/05",2012.001,0,"D_Afgooye"
6206,Agadez,geodetic,,,7011,8901,1177,Topographic mapping.,,,OGP,"1995/06/02",,0,"D_Agadez"
6207,Lisbon 1937,geodetic,"Fundamental point: Castelo Sao Jorge, Lisbon. Latitude: 38°42'43.631""N, longitude: 9°07'54.862""W (of Greenwich).",1937,7022,8901,1294,Topographic mapping.,"Replaces Lisbon 1890 adjustment (which used Bessel 1841 ellipsoid).","Instituto Geografico e Cadastral; Lisbon",OGP,"2008/06/24",2001.551 2008.045,0,"D_Lisbon"
6208,Aratu,geodetic,,,7022,8901,1274,Oil industry geodetic purposes.,,,OGP,"1995/06/02",,0,"D_Aratu"
6209,Arc 1950,geodetic,"Fundamental point: Buffelsfontein. Latitude: 33°59'32.000""S, longitude: 25°30'44.622""E (of Greenwich).",1950,7013,8901,1276,"Topographic mapping, geodetic survey.",,,OGP,"2008/06/24",2008.045,0,"D_Arc_1950"
6210,Arc 1960,geodetic,"Fundamental point: Buffelsfontein. Latitude: 33°59'32.000""S, longitude: 25°30'44.622""E (of Greenwich).",1960,7012,8901,1277,"Topographic mapping, geodetic survey.",,,OGP,"2008/06/24",2008.045,0,"D_Arc_1960"
6211,Batavia,geodetic,"Fundamental point: Longitude at Batavia Astro. Station. Latitude: 6°07'39.522""S, longitude: 106°48'27.790""E (of Greenwich). Latitude and azimuth at Genuk.",,7004,8901,3666,Topographic mapping.,,,OGP,"2010/03/30",2003.361 2008.045 2009.106,0,"D_Batavia"
6212,Barbados 1938,geodetic,"Fundamental point: HMS Challenger astro station M1, St. Anne's Tower. Latitude 13°04'32.53""N, longitude 59°36'29.34""W (of Greenwich).",1938,7012,8901,3218,Topographic mapping.,,Ordnance Survey of Great Britain.,OGP,"2011/06/30",1999.170 2006.030 2008.045 2011.051,0,"D_Barbados_1938"
6213,Beduaram,geodetic,,,7011,8901,2771,Topographic mapping.,,,OGP,"2004/09/01",2004.490,0,"D_Beduaram"
6214,Beijing 1954,geodetic,"Pulkovo, transferred through Russian triangulation.",1954,7024,8901,3228,Topographic mapping.,Scale determined through three baselines in northeast China. Discontinuities at boundaries of adjustment blocks. From 1982 replaced by Xian 1980 and New Beijing.,"Chinese Science Bulletin, 2009, 54:2714-2721",OGP,"2009/11/24",2009.084,0,"D_Beijing_1954"
6215,Reseau National Belge 1950,geodetic,"Fundamental point: Lommel (tower). Latitude: 51°13'47.334""N, longitude: 5°18'49.483""E (of Greenwich).",1950,7022,8901,1347,Topographic mapping.,,,OGP,"2008/06/24",2003.361 2008.045,0,"D_Belge_1950"
6216,Bermuda 1957,geodetic,"Fundamental point: Fort George base. Latitude 32°22'44.36""N, longitude 64°40'58.11""W (of Greenwich).",1957,7008,8901,3221,Topographic mapping.,,Various oil industry sources.,OGP,"2011/01/25",2003.362 2008.045 2011.004,0,"D_Bermuda_1957"
6218,Bogota 1975,geodetic,"Fundamental point: Bogota observatory. Latitude: 4°35'56.570""N, longitude: 74°04'51.300""W (of Greenwich).",1975,7022,8901,3686,Topographic mapping.,"Replaces 1951 adjustment. Replaced by MAGNA-SIRGAS (datum code 6685).","Instituto Geografico Agustin Codazzi (IGAC) special publication no. 1, 4th edition (1975) ""Geodesia: Resultados Definitvos de Parte de las Redes Geodesicas Establecidas en el Pais"".",OGP,"2010/03/30",2000.200 2005.060 2007.060 2008.045 2009.106,0,"D_Bogota"
6219,Bukit Rimpah,geodetic,"2°00'40.16""S, 105°51'39.76""E (of Greenwich).",,7004,8901,1287,Topographic mapping.,,,OGP,"2008/06/24",2008.045,0,"D_Bukit_Rimpah"
6220,Camacupa,geodetic,"Fundamental point: Campo de Aviaçao. Latitude: 12°01'09.070""S, Longitude = 17°27'19.800""E (of Greenwich)",1948,7012,8901,1288,Coastal hydrography.,,"Portuguese Hydrographic Institute and Clifford J. Mugnier, PE&RS journal, March 2001.",OGP,"2008/06/24",2003.361 2006.973 2008.045,0,"D_Camacupa"
6221,Campo Inchauspe,geodetic,"Fundamental point: Campo Inchauspe. Latitude: 35°58'16.56""S, longitude: 62°10'12.03""W (of Greenwich).",,7022,8901,3843,Topographic mapping.,,"NIMA http://earth-info.nima.mil/",OGP,"2011/03/28",2003.361 2005.460 2008.045 2011.021,0,"D_Campo_Inchauspe"
6222,Cape,geodetic,"Fundamental point: Buffelsfontein. Latitude: 33°59'32.000""S, longitude: 25°30'44.622""E (of Greenwich).",,7013,8901,1290,"Geodetic survey, cadastre, topographic mapping, engineering survey.",,"Private Communication, Directorate of Surveys and Land Information, Cape Town.",OGP,"2008/06/24",1996.250 1999.690 2008.045,0,"D_Cape"
6223,Carthage,geodetic,"Fundamental point: Carthage. Latitude: 40.9464506g = 36°51'06.50""N, longitude: 8.8724368g E of Paris = 10°19'20.72""E (of Greenwich).",1925,7011,8901,1236,Topographic mapping.,Fundamental point astronomic coordinates determined in 1878.,,OGP,"2008/06/24",2003.362 2003.050 2008.045,0,"D_Carthage"
6224,Chua,geodetic,"Fundamental point: Chua. Latitude: 19°45'41.160""S, longitude: 48°06'07.560""W (of Greenwich).",,7022,8901,3356,Geodetic survey.,The Chua origin and associated network is in Brazil with a connecting traverse through northern Paraguay. It was used in Brazil only as input into the Corrego Allegre adjustment and for government work in Distrito Federal.,"NIMA http://earth-info.nima.mil/",OGP,"2009/06/02",2003.361 2005.460 2005.840 2006.490 2008.045 2009.021,0,"D_Chua"
6225,Corrego Alegre 1970-72,geodetic,"Fundamental point: Corrego Alegre. Latitude: 19°50'14.91""S, longitude: 48°57'41.98""W (of Greenwich).",1972,7022,8901,1293,"Topographic mapping, geodetic survey. Superseded by SAD69.","Replaces 1961 adjustment (datum code 1074). NIMA gives coordinates of origin as latitude: 19°50'15.14""S, longitude: 48°57'42.75""W; these may refer to 1961 adjustment.",IBGE.,OGP,"2011/07/27",2005.841 2008.045 2011.053,0,"D_Corrego_Alegre"
6226,"Cote d'Ivoire",geodetic,,,7011,8901,1075,Topographic mapping.,,,OGP,"1995/06/02",2001.110,1,"D_Cote_d_Ivoire"
6227,Deir ez Zor,geodetic,"Fundamental point: Trig. 254 Deir. Latitude: 35°21'49.975""N, longitude: 40°05'46.770""E (of Greenwich).",,7011,8901,1623,Topographic mapping.,,,OGP,"2008/06/24",2003.361 2008.045,0,"D_Deir_ez_Zor"
6228,Douala,geodetic,,,7011,8901,1060,Topographic mapping.,,,OGP,"1995/06/02",,1,"D_Douala"
6229,Egypt 1907,geodetic,"Fundamental point: Station F1 (Venus). Latitude: 30°01'42.86""N, longitude: 31°16'33.60""E (of Greenwich).",1907,7020,8901,1086,"Geodetic survey, cadastre, topographic mapping, engineering survey.",,,OGP,"2008/06/24",2008.045,0,"D_Egypt_1907"
6230,European Datum 1950,geodetic,"Fundamental point: Potsdam (Helmert Tower). Latitude: 52°22'51.4456""N, longitude: 13°03'58.9283""E (of Greenwich).",1950,7022,8901,1296,"Topographic mapping, geodetic survey.",,"EuroGeographics; http://crs.bkg.bund.de/crs-eu/",OGP,"2008/06/24",2003.361 2008.045,0,"D_European_1950"
6231,European Datum 1987,geodetic,"Fundamental point: Potsdam (Helmert Tower). Latitude: 52°22'51.4456""N, longitude: 13°03'58.9283""E (of Greenwich).",1987,7022,8901,1297,Scientific network.,,,OGP,"2008/06/24",2003.362 2008.045,0,"D_European_1987"
6232,Fahud,geodetic,"Fundamental point: Station NO68-024 Fahud. Latitude: 22°17'31.182""N, longitude: 56°29'18.820""E (of Greenwich).",,7012,8901,4009,Oil industry mapping.,"Replaced by PSD93 (code 6134).",Petroleum Development Oman.,OGP,"2012/02/13",2008.045 2011.042,0,"D_Fahud"
6233,Gandajika 1970,geodetic,,1970,7022,8901,1152,Topographic mapping.,,,OGP,"1995/06/02",,1,
6234,Garoua,geodetic,,,7011,8901,1060,Topographic mapping.,"The intent of the Bukavu 1953 conference was to adopt the Clarke 1880 (RGS) ellipsoid (code 7012) but in practice this datum has used the IGN version.",,OGP,"1995/06/02",,1,"D_Garoua"
6235,Guyane Francaise,geodetic,,,7022,8901,1097,Topographic mapping.,,,OGP,"1995/06/02",,1,"D_Guyane_Francaise"
6236,Hu Tzu Shan 1950,geodetic,"Fundamental point: Hu Tzu Shan. Latitude: 23°58'32.34""N, longitude: 120°58'25.975""E (of Greenwich).",1950,7022,8901,3315,Topographic mapping.,,"NIMA 
US NGA, http://earth-info.nga.mil/GandG/index.html",OGP,"2008/08/12",2003.362 2005.460 2005.830 2008.017 2008.045,0,"D_Hu_Tzu_Shan"
6237,Hungarian Datum 1972,geodetic,"Fundamental point: Szolohegy. Latitude: 47°17'32,6156""N, longitude 19°36'09.9865""E (of Greenwich); geoid height 6.56m.",1972,7036,8901,1119,Topographic mapping.,"Replaced Hungarian Datum 1909 (EPSG datum code 1024).","http://lazarus.elte.hu/gb/geodez/geod3.htm",OGP,"2008/08/02",1996.090 2008.045 2008.047,0,"D_Hungarian_1972"
6238,Indonesian Datum 1974,geodetic,"Fundamental point: Padang. Latitude: 0°56'38.414""S, longitude: 100°22' 8.804""E (of Greenwich). Ellipsoidal height 3.190m, gravity-related height 14.0m above mean sea level.",1974,7021,8901,4020,Topographic mapping.,Replaced by DGN95.,Bakosurtanal 1979 paper by Jacob Rais.,OGP,"2012/03/25",2002.151 2006.810 2008.045 2012.032,0,"D_Indonesian_1974"
6239,Indian 1954,geodetic,Extension of Kalianpur 1937 over Myanmar and Thailand.,1954,7015,8901,1304,Topographic mapping.,,,OGP,"2003/12/31",2003.361,0,"D_Indian_1954"
6240,Indian 1975,geodetic,"Fundamental point: Khau Sakaerang.",1975,7015,8901,3741,Topographic mapping.,,,OGP,"2011/01/25",2011.004,0,"D_Indian_1975"
6241,Jamaica 1875,geodetic,"Fundamental point: Fort Charles Flagstaff. Latitude: 17°55'55.800""N, longitude: 76°56'37.260""W (of Greenwich).",1875,7034,8901,3342,Topographic mapping.,,"Survey Department, Government of Jamaica, 1983.",OGP,"2008/06/24",2004.510 2008.045,0,"D_Jamaica_1875"
6242,Jamaica 1969,geodetic,"Fundamental point: Fort Charles Flagstaff. Latitude: 17°55'55.800""N, longitude: 76°56'37.260""W (of Greenwich).",1969,7008,8901,3342,"Geodetic survey, cadastre, topographic mapping, engineering survey.",,"Survey Department, Government of Jamaica, 1983.",OGP,"2008/06/24",2004.510 2008.045,0,"D_Jamaica_1969"
6243,Kalianpur 1880,geodetic,"Fundamental point: Kalianpur. Latitude: 24°07'11.260""N, longitude: 77°39'17.570""E (of Greenwich).",1880,7042,8901,1307,Topographic mapping.,"Includes 1916 extension into Burma (Myanmar).  Replaced by 1937 adjustment.","G. Bomford; ""The Re-adjustment of the Indian Triangulation""; Survey of India Professional Paper 28; 1939.",OGP,"2008/06/24",1997.231 2004.290 2008.045,0,"D_Kalianpur_1880"
6244,Kandawala,geodetic,"Fundamental point: Kandawala. Latitude: 7°14'06.838""N, longitude: 79°52'36.670""E.",1930,7015,8901,3310,Topographic mapping.,,"Abeyratne, Featherstone and Tantrigoda in Survey Review vol. 42 no. 317 (July 2010).",OGP,"2010/09/24",2010.080,0,"D_Kandawala"
6245,Kertau 1968,geodetic,"Fundamental point: Kertau. Latitude: 3°27'50.710""N, longitude: 102°37'24.550""E (of Greenwich).",1968,7018,8901,1309,"Geodetic survey, cadastre.","Replaces MRT48 and earlier adjustments. Adopts metric conversion of 39.370113 inches per metre. Not used for 1969 metrication of RSO grid - see Kertau (RSO) (code 6751).",Defence Geographic Centre.,OGP,"2008/06/24",2006.251 2008.045,0,"D_Kertau"
6246,Kuwait Oil Company,geodetic,"Fundamental point: K28.  Latitude: 29°03'42.348""N, longitude: 48°08'42.558""E (of Greenwich).",1952,7012,8901,3267,Oil industry mapping.,,,OGP,"2008/06/24",2004.410 2008.045,0,"D_Kuwait_Oil_Company"
6247,La Canoa,geodetic,"Fundamental point: La Canoa. Latitude: 8°34'17.170""N, longitude: 63°51'34.880""W (of Greenwich).",,7022,8901,3327,"Geodetic survey, topographic mapping, engineering survey.","Origin and network incorporated within PSAD56 (datum code 6248).",,OGP,"2011/01/25",2008.045 2011.001,0,"D_La_Canoa"
6248,Provisional South American Datum 1956,geodetic,"Fundamental point: La Canoa. Latitude: 8°34'17.170""N, longitude: 63°51'34.880""W (of Greenwich).",1956,7022,8901,1348,Topographic mapping.,Same origin as La Canoa datum.,,OGP,"2008/06/24",2008.045,0,"D_Provisional_S_American_1956"
6249,Lake,geodetic,"Fundamental point: Maracaibo Cathedral. Latitude: 10°38'34.678""N, longitude: 71°36'20.224""W (of Greenwich).",,7022,8901,1312,Oil industry mapping.,,,OGP,"2008/06/24",2008.045,0,"D_Lake"
6250,Leigon,geodetic,"Fundamental point: GCS Station 121, Leigon. Latitude: 5°38'52.27""N, longitude: 0°11'46.08""W (of Greenwich).",,7012,8901,1104,Topographic mapping.,"Replaced Accra datum (code 6168) from 1978.  Coordinates at Leigon fundamental point defined as Accra datum values for that point.",Ordnance Survey International,OGP,"2008/06/24",2008.045,0,"D_Leigon"
6251,Liberia 1964,geodetic,"Fundamental point: Robertsfield. Latitude: 6°13'53.02""N, longitude: 10°21'35.44""W (of Greenwich).",1964,7012,8901,3270,Topographic mapping.,,"NIMA http://earth-info.nima.mil/",OGP,"2008/06/24",2003.362 2005.460 2008.045,0,"D_Liberia_1964"
6252,Lome,geodetic,,,7011,8901,1232,Topographic mapping.,,,OGP,"1995/06/02",,0,"D_Lome"
6253,Luzon 1911,geodetic,"Fundamental point: Balacan. Latitude: 13°33'41.000""N, longitude: 121°52'03.000""E (of Greenwich).",1911,7008,8901,3969,Topographic mapping.,"Replaced by Philippine Reference system of 1992 (datum code 6683).",Coast and Geodetic Survey,OGP,"2012/03/25",2004.730 2008.045 2012.032,0,"D_Luzon_1911"
6254,Hito XVIII 1963,geodetic,Chile-Argentina boundary survey.,1963,7022,8901,1303,Geodetic survey.,Used in Tierra del Fuego.,Various oil company records.,OGP,"1995/06/02",,0,"D_Hito_XVIII_1963"
6255,Herat North,geodetic,"Fundamental point: Herat North. Latitude: 34°23'09.08""N, longitude: 64°10'58.94""E (of Greenwich).",,7022,8901,1024,Topographic mapping.,,"NIMA http://earth-info.nima.mil/",OGP,"2008/06/24",2003.362 2005.460 2008.045,0,"D_Herat_North"
6256,Mahe 1971,geodetic,"Fundamental point: Mahe.",1971,7012,8901,2369,Topographic mapping.,,,OGP,"2012/02/13",2012.025,0,"D_Mahe_1971"
6257,Makassar,geodetic,"Fundamental point: station P1, Moncongloe. Latitude: 5°08'41.42""S, long 119°24'14.94""E (of Greenwich).",,7004,8901,1316,Topographic mapping.,,"NIMA http://earth-info.nima.mil/",OGP,"2008/06/24",2003.361 2005.460 2008.045,0,"D_Makassar"
6258,European Terrestrial Reference System 1989,geodetic,Fixed to the stable part of the Eurasian continental plate and consistent with ITRS at the epoch 1989.0.,1989,7019,8901,1298,Geodetic survey.,"The distinction in usage between ETRF89 and ETRS89 is confused: although in principle conceptually different in practice both are used for the realisation.",,OGP,"2003/08/14",1997.110 1997.550 1999.111 2000.720 2003.260,0,"D_ETRS_1989"
6259,Malongo 1987,geodetic,"Fundamental point: Station Y at Malongo base camp. Latitude: 5°23'30.810""S, longitude: 12°12'01.590""E (of Greenwich).",1987,7022,8901,3180,Oil industry offshore exploration and production from 1987.,"Replaced Mhast (offshore) (code 6705) in 1987. Origin coordinates constrained to those of Mhast (offshore) but other station coordinates differ. References to ""Mhast"" since 1987 often should have stated ""Malongo 1987"".",Chevron Petroleum Technology.,OGP,"2008/06/24",2005.751 2008.045,0,"D_Malongo_1987"
6260,Manoca,geodetic,,,7012,8901,1060,Topographic mapping.,,,OGP,"1995/06/02",,1,"D_Manoca"
6261,Merchich,geodetic,"Fundamental point: Merchich. Latitude: 33°26'59.672""N, longitude: 7°33'27.295""W (of Greenwich).",1922,7011,8901,3280,Topographic mapping.,,,OGP,"2008/06/24",2003.361 2008.045,0,"D_Merchich"
6262,Massawa,geodetic,,,7004,8901,1089,Topographic mapping.,,,OGP,"1995/06/02",,0,"D_Massawa"
6263,Minna,geodetic,"Fundamental point: Minna base station L40. Latitude: 9°38'08.87""N, longitude: 6°30'58.76""E (of Greenwich).",,7012,8901,1178,Topographic mapping.,,"NIMA http://earth-info.nima.mil/",OGP,"2008/06/24",2003.361 2005.460 2008.045,0,"D_Minna"
6264,Mhast,geodetic,,,7022,8901,1318,Coastal hydrography.,,,OGP,"1995/06/02",,1,
6265,Monte Mario,geodetic,"Fundamental point: Monte Mario. Latitude: 41°55'25.51""N, longitude: 12°27'08.4""E (of Greenwich).",1940,7022,8901,3343,Topographic mapping.,"Replaced Genova datum, Bessel 1841 ellipsoid, from 1940.",,OGP,"2008/06/24",2003.360 2008.045,0,"D_Monte_Mario"
6266,"M'poraloko",geodetic,,,7011,8901,1100,Topographic mapping.,,,OGP,"1995/06/02",,0,"D_Mporaloko"
6267,North American Datum 1927,geodetic,"Fundamental point: Meade's Ranch. Latitude: 39°13'26.686""N, longitude: 98°32'30.506""W (of Greenwich).",1927,7008,8901,1349,Topographic mapping.,"In United States (USA) and Canada, replaced by North American Datum 1983 (NAD83) (code 6269) ; in Mexico, replaced by Mexican Datum of 1993 (code 1042).",,OGP,"2009/11/24",2008.024 2008.045 2009.087,0,"D_North_American_1927"
6268,NAD27 Michigan,geodetic,"Fundamental point: Meade's Ranch. Latitude: 39°13'26.686""N, longitude: 98°32'30.506""W (of Greenwich).",,7009,8901,1391,Topographic mapping.,Ellipsoid taken to be 800ft above the NAD27 reference ellipsoid.,"USGS Professional Paper #1395.",OGP,"2011/02/25",2008.045 2011.013 2013.020,1,
6269,North American Datum 1983,geodetic,Origin at geocentre.,1986,7019,8901,1350,Topographic mapping.,"Although the 1986 adjustment included connections to Greenland and Mexico, it has not been adopted there. In Canada and US, replaced NAD27.",,OGP,"2008/04/11",2006.464 2008.024,0,"D_North_American_1983"
6270,Nahrwan 1967,geodetic,"Fundamental point: Nahrwan south base.  Latitude: 33°19'10.87""N, longitude: 44°43'25.54""E (of Greenwich).",1967,7012,8901,1351,Topographic mapping.,"In Iraq, replaces Nahrwan 1934.",,OGP,"2008/06/24",2006.340 2008.045,0,"D_Nahrwan_1967"
6271,Naparima 1972,geodetic,"Fundamental point: Naparima. Latitude: 10°16'44.860""N, longitude: 61°27'34.620""W (of Greenwich).",1972,7022,8901,1322,Topographic mapping.,Naparima 1972 is an extension of the Naparima 1955 network of Trinidad to include Tobago.,Ordnance Survey International.,OGP,"2008/06/24",2008.045,0,"D_Naparima_1972"
6272,New Zealand Geodetic Datum 1949,geodetic,"Fundamental point: Papatahi. Latitude: 41°19' 8.900""S, longitude: 175°02'51.000""E (of Greenwich).",1949,7022,8901,3285,"Geodetic survey, cadastre, topographic mapping, engineering survey.","Replaced by New Zealand Geodetic Datum 2000 (code 6167) from March 2000.","Land Information New Zealand. http://www.linz.govt.nz/rcs/linz/pub/web/root/core/SurveySystem/GeodeticInfo/GeodeticDatums/nzgd2000factsheet/index.jsp",OGP,"2008/06/24",2000.702 2004.110 2008.045,0,"D_New_Zealand_1949"
