"DATUM_CODE","DATUM_NAME","DATUM_TYPE","ORIGIN_DESCRIPTION","REALIZATION_EPOCH","ELLIPSOID_CODE","PRIME_MERIDIAN_CODE","AREA_OF_USE_CODE","DATUM_SCOPE","REMARKS","INFORMATION_SOURCE","DATA_SOURCE","REVISION_DATE","CHANGE_ID","DEPRECATED","ESRI_DATUM_NAME"
1024,Hungarian Datum 1909,geodetic,"Fundamental point not given in information source, but presumably Szolohegy which is origin of later HD72.",1909,7004,8901,1119,Topographic mapping.,"Replaced earlier HD1863 adjustment also on Bessel ellipsoid. Both HD1863 and HD1909 were originally on Ferro Prime Meridian but subsequently converted to Greenwich. Replaced by HD72 (datum code 6237).","Timár, Molnár and Márta in Geodezia es Kartografia 55(3) pp16-21. www.fomi.hu/internet/magyar/szaklap/geodkart.htm",OGP,"2008/08/02",,0,"D_Hungarian_Datum_1909"
1025,Taiwan Datum 1967,geodetic,"Fundamental point: Hu Tzu Shan. Latitude: 23°58'32.34""N, longitude: 120°58'25.975""E (of Greenwich).",1967,7050,8901,3315,"Geodetic survey, cadastre, topographic mapping, engineering survey.","Adopted in 1980. TWD67 uses the GRS 1967 ellipsoid but with 1/f to exactly 2 decimal places.","National Land Surveying and Mapping Center (NLSC), http://www.nlsc.gov.tw",OGP,"2008/08/11",,0,"D_TWD_1967"
1026,Taiwan Datum 1997,geodetic,ITRF94 at epoch 1997.0,1997,7019,8901,1228,"Geodetic survey, GIS, topographic mapping, engineering survey.",Adopted in 1998.,"National Land Surveying and Mapping Center (NLSC), http://www.nlsc.gov.tw",OGP,"2008/08/11",,0,"D_TWD_1997"
1027,EGM2008 geoid,vertical,WGS 84 ellipsoid.,2008,,,1262,Geodesy.,,"http://earth-info.nga.mil/GandG/wgs84/gravitymod/egm2008/egm08_wgs84.html",OGP,"2009/01/30",2008.097,0,
1028,Fao 1979,vertical,"Average sea level at Fao during two-year period in mid/late 1970s.",1979,,,3625,"Topographic mapping, geodetic survey.","Levelling network established by Polservice consortium.  Replaces Fao (datum code 5149) in Iraq.","Survey Division, Ministry of Water Resources (MoWR).",OGP,"2010/03/01",2009.003 2010.014,0,
1029,Iraqi Geospatial Reference System,geodetic,ITRF2000 at epoch 1997.0,2000,7019,8901,1124,Geodetic survey.,,"Survey Division, Ministry of Water Resources (MoWR).",OGP,"2009/02/03",2009.003,0,"D_Iraqi_Geospatial_Reference_System"
1030,N2000,vertical,"Height at Metsaahovi (latitude 60.21762°N, longitude 24.39517°E) of 54.4233m related to EVRF2000 origin through Baltic Levelling Ring adjustment at epoch 2000.0.",2000,,,3333,"Topographic mapping, geodetic survey.","Realised through the third precise levelling network. Uses normal heights. Replaces N60 (datum code 5116). To account for isostatic land uplift use NKG2005 model.","National Land Survey of Finland;
http://www.maanmittauslaitos.fi",OGP,"2009/02/21",2008.112,0,
1031,MGI 1901,geodetic,"Fundamental point: Hermannskogel. Latitude: 48°16'15.29""N, longitude: 16°17'55.04""E (of Greenwich).",1901,7004,8901,2370,Geodetic survey.,"The longitude of the datum origin equates to the Albrecht 1902 value for the Ferro meridian of 17°39'46.02"" west of Greenwich. Densified in 1948.","The Ferro prime meridian, Gabor Timar (2007), Geodezia es Kartografia vol 59 issue 12 pages 3-7.",OGP,"2009/05/10",2009.015,0,"D_MGI_1901"
1032,MOLDREF99,geodetic,Densification of ETRS89.,1999,7019,8901,1162,"Geodetic survey, cadastre, topographic mapping, engineering survey.",,"State Agency for Land Relations & Cadastre.",OGP,"2009/05/11",2009.026,0,"D_MOLDREF99"
1033,Reseau Geodesique de la RDC 2005,geodetic,ITRF2000 at epoch 2005.4.,2005,7019,8901,3613,Geodetic survey.,,"""Revision du Tiers Meridional du Reseau Geodesique de la RDC"", COPIREP Reclus project report, 2005.",OGP,"2009/04/16",2009.011,0,"D_Reseau_Geodesique_de_la_RDC_2005"
1034,Serbian Reference Network 1998,geodetic,"Densification of ETRS89 in Serbia at epoch 1998.7 based on coordinates of 6 stations in Serbia of Yugoslav Reference Frame (YUREF) 1998 campaign.",1998,7019,8901,3534,Geodesy.,Observed 1998-2003.,"Delcev et al, FIG Working Week May 2009; http://www.gig.net/pub",OGP,"2009/05/11",2009.015,0,"D_Serbian_Reference_Network_1998"
1035,Red Geodesica de Canarias 1995,geodetic,ITRF93 at epoch 1994.9 at VLBI station Maspalomas on Grand Canary.,1995,7019,8901,3199,"Geodetic survey, cadastre, topographic mapping, engineering survey.","Replaces Pico de las Nieves 1984 (PN84).","IGN Madrid. http://www.fomento.es.",OGP,"2009/05/15",2009.033,0,"D_Red_Geodesica_de_Canarias_1995"
1036,Reseau Geodesique de Mayotte 2004,geodetic,ITRF2000 at epoch 2004.0,2004,7019,8901,1159,"Geodetic survey, topographic mapping, engineering survey.","Replaces Combani 1950 (datum code 6632) except for cadastral purposes. (Cadastre 1997 (datum code 1037) used for cadastral purposes).",IGN Paris.,OGP,"2009/10/02",2009.072,0,"D_Reseau_Geodesique_de_Mayotte_2004"
1037,Cadastre 1997,geodetic,Coordinates of 1 station of Combani 1950 adjustment held fixed.,1997,7022,8901,3340,Cadastral survey.,Derived by adjustment of GPS-observed network which was constrained to Combani 1950 coordinates of one station.,CERTU.,OGP,"2009/10/02",2009.072,0,"D_Cadastre_1997"
1038,Reseau Geodesique de Saint Pierre et Miquelon 2006,geodetic,ITRF2000 at epoch 2006.0,2006,7019,8901,1220,"Geodetic survey, cadastre, topographic mapping, engineering survey.","Replaces Saint Pierre et Miquelon 1950 (datum code 6638).",IGN Paris.,OGP,"2009/10/02",2009.072,0,"D_Reseau_Geodesique_de_St_Pierre_et_Miquelon_2006"
1039,New Zealand Vertical Datum 2009,vertical,New Zealand Quasigeoid 2009 which is defined by the application of the NZ geoid 2009 grid to NZGD2000 ellipsoidal heights. See transformation code 4459.,2009,,,1175,"Geodetic survey, topographic mapping, engineering survey.",,"Land Information New Zealand (LINZ) standard S25004.",OGP,"2012/01/21",2009.081 2011.004 2012.007,0,
1040,Dunedin-Bluff 1960,vertical,Common adjustment of Dunedin 1958 and Bluff 1955 networks.,1960,,,3806,"Geodetic survey, topographic mapping, engineering survey.",,"Land Information New Zealand (LINZ) standard S25004.",OGP,"2011/01/25",2009.081 2011.005,0,
1041,Autonomous Regions of Portugal 2008,geodetic,"ITRF93 as derived from the 1994 TransAtlantic Network for Geodynamics and Oceanography (TANGO) project.",1994,7019,8901,3670,Geodetic survey.,Replaces older classical datums for Azores and Madeira archipelagos.,"Instituto Geografico Portugues; http://www.igeo.pt",OGP,"2010/03/30",2010.006,0,"D_PTRA08"
1042,Mexico ITRF92,geodetic,ITRF1992 at epoch 1988.00.,1993,7019,8901,1160,Geodetic survey.,"Realised by a frame of 15 active GPS stations observed and adjusted in the ITRF1992. Includes ties to tide gauges. Replaces NAD27 (datum code 6267). Replaced by Mexico ITRF2008 (datum code 1120) from December 2010.","National Densifications per http://www.sirgas.org. See also www.fig.net/pub/cairo/papers/ts_13/ts13_03_hansen.pdf.",OGP,"2013/08/23",2009.087 2010.090 2013.032,0,"D_Mexican_Datum_of_1993"
1043,China 2000,geodetic,ITRF97 at epoch 2000.0,2000,1024,8901,1067,"Geodetic survey, topographic and engineering survey.",Combined adjustment of astro-geodetic observations as used for Xian 1980 and GPS control network observed 2000-2003. Adopted July 2008.,Chinese Academy of Surveying and Mapping.,OGP,"2012/01/05",2009.084 2011.103,0,"D_China_2000"
1044,Sao Tome,geodetic,"Fundamental point: Fortaleza. Latitude: 0°20'49.02""N, longitude: 6°44'41.85""E (of Greenwich).",,7022,8901,3645,"Topographic mapping, geodetic survey.",,"US Department of State Bureau of Intelligence and Research ""Limits in the Sea"" series #98.",OGP,"2009/11/24",2009.098,0,"D_Sao_Tome"
1045,New Beijing,geodetic,Derived by conformal transformation of Xian 1980 adjustment onto Krassowsky ellipsoid.,1982,7024,8901,3228,Topographic mapping.,From 1982 replaces Beijing 1954.,"Chinese Science Bulletin, 2009, 54:2714-2721.",OGP,"2010/03/01",2009.092 2010.014,0,"D_New_Beijing"
1046,Principe,geodetic,"Fundamental point: Morro do Papagaio. Latitude: 1°36'46.87""N, longitude: 7°23'39.65""E (of Greenwich).",,7022,8901,3646,"Topographic mapping, geodetic survey.",,"US Department of State Bureau of Intelligence and Research ""Limits in the Sea"" series #98.",OGP,"2009/11/24",2009.098,0,"D_Principe"
1047,Reseau de Reference des Antilles Francaises 1991,geodetic,WGS 84 coordinates of a single station determined during the 1988 Tango mission.,1991,7019,8901,2824,"Geodetic survey, cadastre, topographic mapping, engineering survey.","Replaces Fort Marigot and Sainte Anne (datum codes 6621-22) in Guadeloupe and Fort Desaix (datum code 6625) in Martinique. Replaced by Reseau Geodesique des Antilles Francaises 2009 (datum code 1073).",IGN Paris.,OGP,"2011/05/09",2009.073 2011.030,0,"D_RRAF_1991"
1048,Tokyo 1892,geodetic,"Fundamental point: Nikon-Keido-Genten. Latitude: 35°39'17.5148""N, longitude: 139°44'30.0970""E (of Greenwich). Longitude derived in 1892.",1892,7004,8901,1364,"Cadastre, topographic mapping, engineering survey.","Extended from Japan to Korea in 1898. In Japan replaced by Tokyo 1918 (datum code 6301). In South Korea replaced by Tokyo 1918 (code 6301) only for geodetic purposes; for all other purposes replaced by Korean 1985 (code 6162).",Korean Association of Surveying and Mapping.,OGP,"2010/06/30",2010.050,0,
1049,Incheon,vertical,MSL 1913-1916 at Incheon Bay.,1963,,,3739,"Topographic mapping, geodetic survey.",,"National Geographic Information Institute (NGII).",OGP,"2010/06/30",2010.050,0,
1050,Trieste,vertical,"Reference point HM1(BV1)-Trieste defined relative to mean sea level at Trieste in 1875.",1875,,,2370,"Geodetic survey, topographic mapping, engineering survey.","Normal-orthometric heights. In Croatia replaced by HVRS71 (datum code 5207).","Eurogeographics, http://www.crs-geo.eu",OGP,"2010/07/12",2010.064,0,
1051,Genoa,vertical,,1942,,,3736,"Geodetic survey, topographic mapping, engineering survey.",Orthometric heights.,"Eurogeographics, http://www.crs-geo.eu",OGP,"2010/07/12",2010.064,0,
1052,"System Jednotne Trigonometricke Site Katastralni/05",geodetic,Constrained to S-JTSK but realised through readjustment in projected CRS domain. Related to ETRS89 R05 realisation through transformation code 5226.,2009,7004,8901,1079,"Geodetic survey, cadastre, topographic mapping, engineering survey.","S-JTSK = System of the Unified Trigonometrical Cadastral Network.","Land Survey Office (ZU), Prague. www.cuzk.cz/zu",OGP,"2010/10/29",2010.071,0,"D_S_JTSK_05"
1053,Sri Lanka Datum 1999,geodetic,"Fundamental point: ISM Diyatalawa. Latitude: 6°49'02.687""N, longitude: 80°57'40.880""E.",1999,7015,8901,3310,Topographic mapping.,Introduced in 2000.,"Abeyratne, Featherstone and Tantrigoda in Survey Review vol. 42 no. 317 (July 2010).",OGP,"2010/08/07",2010.080,0,"D_Sri_Lanka_Datum_1999"
1054,Sri Lanka Vertical Datum,vertical,MSL at Colombo 1884-1889.,1932,,,3310,"Geodetic survey, topographic mapping, engineering survey.","Normal-orthometric heights, but often referred to as ""orthometric"".","Abeyratne, Featherstone and Tantrigoda in Survey Review vol. 42 no. 317 (July 2010).",OGP,"2010/08/07",2010.080,0,
1055,"System Jednotne Trigonometricke Site Katastralni/05 (Ferro)",geodetic,Constrained to S-JTSK but realised through readjustment in projected CRS domain.,2009,7004,8909,1079,"Geodetic survey, cadastre, topographic mapping, engineering survey.","S-JTSK = System of the Unified Trigonometrical Cadastral Network.","Land Survey Office (ZU), Prague. www.cuzk.cz/zu",OGP,"2010/10/29",2010.071,0,"D_S_JTSK_05"
1056,Geocentric Datum Brunei Darussalam 2009,geodetic,ITRF2005 at epoch 2009.45,2009,7019,8901,1055,Geodetic survey.,Replaces use of Timbalai from July 2009.,"Survey Department, Brunei.",OGP,"2010/09/22",2010.057,0,"D_GDBD2009"
1057,Turkish National Reference Frame,geodetic,ITRF96 at epoch 2005.0,2005,7019,8901,1237,Geodetic survey.,,"General Command of Mapping via EuroGeographics; http://www.crs-geo.eu/",OGP,"2010/09/06",2010.085,0,"D_Turkish_National_Reference_Frame"
1058,Bhutan National Geodetic Datum,geodetic,ITRF2000 at epoch 2003.87,2000,7019,8901,1048,Geodetic survey.,,"Department of Survey and Land Records (DSLR), National Land Commission of Bhutan (NLC) via Lantmäteriet Sweden.",OGP,"2010/09/06",2010.086,0,"D_Bhutan_National_Geodetic_Datum"
1059,Faroe Islands Vertical Reference 2009,vertical,,2009,,,3248,Topographic mapping and engineering survey,Mean Tidal Height System.,"Kort & Matrikelstyrelsen (KMS), Copenhagen.",OGP,"2010/10/27",2010.092,0,
1060,Islands Net 2004,geodetic,ITRF2000 at epoch 2004.6.,2004,7019,8901,1120,"Geodetic survey, cadastre, topographic mapping, engineering survey.","Replaces ISN93 (datum code 6659).","Landmaelingar Islands (National Land Survey of Iceland). http://www.lmi.is",OGP,"2010/11/12",2010.101,0,"D_Islands_Network_2004"
1061,International Terrestrial Reference Frame 2008,geodetic,Origin at geocentre. The ITRF2008 origin is defined in such a way that there are null translation parameters at epoch 2005.0 and null translation rates between the ITRF2008 and the ILRS SLR time series.,2008,7019,8901,1262,Geodesy.,"Realisation of the IERS Terrestrial Reference System (ITRS) at epoch 2008.0. Replaces ITRF2005 (code 6896).","IGN Paris http://itrf.ensg.ign.fr/itrs_itrf.php",OGP,"2011/01/13",2011.002,0,
1062,Posiciones Geodesicas Argentinas 2007,geodetic,"A geodetic network of 211 high accuracy surveyed points (178 passive and 33 continuous operating) based on ITRF2005, Epoch 2006.6, that define the National Geodetic System (Sistema Geodésico Nacional) effective 15 May 2009.",2009,7019,8901,1033,"Topographic mapping, geodetic survey.","POSGAR 07 has been adopted by order of the Director of the National Geographic Institute on May 15, 2009, as the new National Geodetic Reference Frame and replaces the pre-existing POSGAR 94.","Instituto Geográfico Militar de la República Argentina, http://www.ign.gob.ar/proyectos/posgar2007/introduccion",OGP,"2011/03/24",2009.028,0,"D_POSGAR_2007"
1063,Marco Geodesico Nacional,geodetic,"ITRF94 at epoch 1995.4.  Densification of SIRGAS95 network in Bolivia, consisting of 125 passive geodetic stations and 8 continuous recording GPS stations.",2007,7019,8901,1049,Geodetic survey.,"Densification of SIRGAS 1995 within Bolivia. Replaces PSAD56 (datum code 6248) in Bolivia.","Sistema de Referencia Geocentrico para las Americas (SIRGAS) Boletin Informativo No 12, Aug 2007 and www.sirgas.org/fileadmin/docs/Boletines/Bol12/09_Actividades_SIRGAS_en_Bolivia_Herbas.pdf by Instituto Geográfico Militar de Bolivia, June 2007.",OGP,"2011/03/20",2011.018,0,"D_Marco_Geodesico_Nacional"
1064,SIRGAS-Chile,geodetic,"ITRF2000 at epoch 2002.0.  Densification of SIRGAS 2000 network in Chile, consisting of 650 monumented stations.",2007,7019,8901,1066,Geodetic survey.,"Densification of SIRGAS 2000 within Chile. Replaces PSAD56 (datum code 6248) in Chile, replaces HITO XVIII (datum code 6254) in Chilean Tierra del Fuego and replaces Easter Island 1967 (datum code 6719)  in Easter Island.","IGM Chile Report: 31_Parra_Baez_Chilean_part_of_SIRGAS.pdf on sirgas.org website (www.sirgas.org website national networks list shows 269 passive and 13 continuous stations in this network whereas IGM Chile source document cites 650 stations).",OGP,"2011/03/20",2011.018,0,"D_SIRGAS-Chile"
1065,Costa Rica 2005,geodetic,"ITRF2000 at epoch 2005.8.  Network of 34 GPS stations throughout the country, five of which were connected to four Caribbean area ITRF stations.",2005,7030,8901,1074,Geodetic survey.,"Replaces Ocotepeque (datum code 1070) in Costa Rica from March 2007.","Instituto Geografico Nacional Costa Rica report: El Sistema de Referencia CR05 y la Proyeccion Transversal de Mercator para Costa Rica CRTM05. (Report available through www.sirgas.org website in national networks list).",OGP,"2011/03/20",2011.018,0,"D_Costa_Rica_2005"
1066,Sistema Geodesico Nacional de Panama MACARIO SOLIS,geodetic,"ITRF2000 at epoch 2000.0. Densification of SIRGAS 2000 network in Panama, consisting of 20 GPS stations throughout the country.",,7019,8901,1186,Geodetic survey.,,Details taken from summary on national networks list on www.sirgas.org website.,OGP,"2011/03/20",2011.018,0,"D_SGNP_MARCARIO_SOLIS"
1067,Peru96,geodetic,"ITRF94 at epoch 1995.4.  Densification of SIRGAS95 network in Peru, consisting of 47 passive geodetic stations and 3 continuous recording GPS stations.",1996,7019,8901,1189,Geodetic survey.,"Densification of SIRGAS 1995 within Peru. Replaces PSAD56 (datum code 6248) in Peru.","Details taken from national realizations page of WWW.SIRGAS.ORG, confirmed by reports from IGN Peru.",OGP,"2011/03/20",2011.018,0,"D_Peru96"
1068,SIRGAS-ROU98,geodetic,"ITRF94 at epoch 1995.4.  Densification of SIRGAS95 network in Uruguay, consisting of 17 passive geodetic stations and 3 continuous recording GPS stations.",1998,7030,8901,1247,Geodetic survey.,"Densification of SIRGAS 1995 within Uruguay. Replaces Yacare (datum code 6309) in Uruguay. Uruguay documentation clearly states use of WGS 84 reference ellipsoid.","Sistema de Referencia Geocentrico para las Americas: SIRGAS, Boletin Informativo No 12, Aug 2007; www.sirgas.org.national network densification summary and NuevoMarco Uruguay_param.pdf by Servicio Geográfico Militar of Uruguay, May 2004.",OGP,"2011/03/20",2011.018,0,"D_SIRGAS-ROU98"
1069,"SIRGAS_ES2007.8",geodetic,"ITRF2005 at epoch 2007.8.  Densification of SIRGAS-CON network in El Salvador, consisting of 38 monumented stations.",2007,7019,8901,1087,Geodetic survey.,SIRGAS-ES2007.8 is the national SIRGAS densification.,"Integration of the reference frame of El Salvador into SIRGAS (SIRGAS-ES2007.8) report by GG-IGCN (El Salvador) & DGFI (Germany) available from www.sirgas.org.  (Information also summarised on www.sirgas.org website national networks list).",OGP,"2011/07/20",2011.018 2011.061,0,"D_SIRGAS_ES2007.8"
1070,Ocotepeque 1935,geodetic,"Fundamental point: Base Norte. Latitude: 14°26'20.168""N, longitude: 89°11'33.964""W.",1935,7008,8901,3876,Topographic mapping and engineering survey.,"Replaced in Costa Rica by Costa Rica 2005 (CR05) from March 2007 and replaced in El Salvador by SIRGAS_ES2007 from August 2007.","Clifford Mugnier's PE&RS articles on Belize, Costa Rica, El Salvador, Guatemala, Honduras, Nicaragua, Panama (www.asprs.org/resources/grids/) also substantiated in IGN Costa Rica report on CR05 / CRTM05 (Report available from WWW.SIRGAS.ORG website).",OGP,"2011/03/26",2011.026,0,"D_Ocotepeque_1935"
1071,Sibun Gorge 1922,geodetic,"Latitude: 17º03'40.471""N, longitude: 88º37'54.687""W.",1922,7007,8901,3219,Topographic mapping and engineering survey.,,"Clifford Mugnier's March 2009 PE&RS ""Grids and Datums"" article on Belize (www.asprs.org/resources/grids/).",OGP,"2011/03/26",2011.026,0,"D_Sibun_Gorge_1922"
1072,Panama-Colon 1911,geodetic,"Fundamental point: Balboa Hill. Latitude: 09°04'57.637""N, longtitude: 79°43'50.313""W.",1911,7008,8901,3290,Topographic mapping and engineering survey.,"Reports of the existence of an Ancon datum are probably erroneous, considering that the origin of the Panamá-Colón Datum of 1911 is at Balboa Hill and the access road up the hill is from the town of Ancon, Canal Zone.","Clifford Mugnier's PE&RS July 1999 Grids and Datums article on The Republic of Panama, (www.asprs.org/resources/grids/).",OGP,"2011/03/26",2011.026,0,"D_Panama-Colon-1911"
1073,Reseau Geodesique des Antilles Francaises 2009,geodetic,ITRF2005 at epoch 2009.0,2009,7019,8901,2824,"Geodetic survey, cadastre, topographic mapping, engineering survey.",Replaces RRAF91 in Martinique and Guadeloupe.,IGN Paris.,OGP,"2011/03/23",2011.030,0,"Reseau_Geodesique_des_Antilles_Francaises_2009"
1074,Corrego Alegre 1961,geodetic,"Fundamental point: Corrego Alegre. Latitude: 19°50'14.91""S, longitude: 48°57'41.98""W (of Greenwich).",1961,7022,8901,3874,"Topographic mapping, geodetic survey.","Replaced by Corrego Alegre 1970-72 (datum code 6225). NIMA gives coordinates of origin as latitude: 19°50'15.14""S, longitude: 48°57'42.75""W.",IBGE,OGP,"2011/07/10",2011.053,0,"D_Corrego_Alegre_1961"
1075,"South American Datum 1969(96)",geodetic,"Fundamental point: Chua. Geodetic latitude: 19°45'41.6527""S; geodetic longitude: 48°06'04.0639""W (of Greenwich). (Astronomic coordinates: Latitude 19°45'41.34""S +/- 0.05"", longitude 48°06'07.80""W +/- 0.08"").",1996,7050,8901,1053,Topographic mapping.,"SAD69 uses GRS 1967 ellipsoid but with 1/f to exactly 2 decimal places. Replaces original 1969 adjustment (datum code 6618) in Brazil.",IBGE.,OGP,"2012/11/26",2011.053 2012.070,0,"D_South_American_Datum_1969_96"
1076,Papua New Guinea Geodetic Datum 1994,geodetic,ITRF92 at epoch 1994.0.,1994,7019,8901,1187,"Topographic mapping, geodetic, engineering and cadastral survey.",Adopted 1996. Coincident with WGS 84 in 1994 but rapidly divergent due to significant tectonic motion in PNG.,"Quickclose Geomatics and http://www.aspng.org/techinfopng94.htm",OGP,"2011/07/15",2011.059,0,"D_Papua_New_Guinea_Geodetic_Datum_1994"
1077,Ukraine 2000,geodetic,Orientation and scale constrained to be same as ITRF2000 at epoch 2005.0. Position is minimised deviation between reference ellipsoid and quasigeoid in territory of Ukraine.,2005,7024,8901,1242,Geodesy.,,"Berlin 2008 GNSS Symposium paper 4-7 (""Creation of ZAKPOS active Network Reference Stations for Transcarpathian Region of Ukraine"") by Savchuk et al.",OGP,"2012/12/17",2011.044 2012.087,0,"D_Ukraine_2000"
1078,Fehmarnbelt Datum 2010,geodetic,ITRF2005 at epoch 2010.14.,2010,7019,8901,3889,Engineering survey and construction of Fehmarnbelt tunnel.,Defined through coordinates of four permanant GNSS stations.,"Femern A/S.",OGP,"2011/09/23",2011.083,0,"D_Fehmarnbelt_Datum_2010"
1079,Fehmarnbelt Vertical Reference 2010,vertical,"Realised by precise levelling between tide gauges at Marienleuchte (Germany), Rodbyhavn (Denmark) and four Fehmarnbelt project GNSS stations.",2010,,,3890,Engineering survey and construction of Fehmarnbelt tunnel.,,"Femern A/S",OGP,"2011/09/24",2011.083,0,
1080,Lowest Astronomic Tide,vertical,The lowest tide level which can be predicted to occur under average meterological conditions and under any combination of astronomical conditions.,,,,1262,Hydrography and Nautical Charting.,"Users are advised to not use this generic vertical datum but to define explicit realisations of LAT by specifying location and epoch, for instance ""LAT at xxx during yyyy-yyyy"".","IHO Dictionary, S-32, 5th Edition, 2936.",OGP,"2012/08/10",2011.047,0,
1081,Deutsche Bahn Reference System,geodetic,"Defined by transformation from ETRS89 (transformation code 5826) to be an average of DHDN across all states of Germany.",,7004,8901,3339,Engineering survey for railway applications.,,"Deutsche Bahn AG via Geo++, www.geopp.de",OGP,"2012/03/25",2011.101 2012.034,0,"D_Deutsche_Bahn_Reference_System"
1082,Highest Astronomic Tide,vertical,The highest tide level which can be predicted to occur under average meterological conditions and under any combination of astronomical conditions.,,,,1262,Hydrography and Nautical Charting.,"Users are advised to not use this generic vertical datum but to define explicit realisations of HAT by specifying location and epoch, for instance ""HAT at xxx during yyyy-yyyy"".","IHO Dictionary, S-32, 5th Edition, 2244.",OGP,"2012/08/10",2011.047,0,
1083,Lower Low Water Large Tide,vertical,"The average of the lowest low waters, one from each of 19 years of observations.",,,,1262,Hydrography and Nautical Charting.,"Users are advised to not use this generic vertical datum but to define explicit realisations of LLWLT by specifying location and epoch, for instance ""LLWLT at xxx during yyyy-yyyy"".",UK Hydrographic Office.,OGP,"2012/08/10",2011.047,0,
1084,Higher High Water Large Tide,vertical,"The average of the highest high waters, one from each of 19 years of observations.",,,,1262,Hydrography and Nautical Charting.,"Users are advised to not use this generic vertical datum but to define explicit realisations of HHWLT by specifying location and epoch, for instance ""HHWLT at xxx during yyyy-yyyy"".",UK Hydrographic Office.,OGP,"2012/08/10",2011.047,0,
1085,Indian Spring Low Water,vertical,"The level below MSL equal to the sum of the amplitudes of the harmonic constituents M2, S2, K1 and O1. It approximates mean lower low water spring tides (MLLWS).",,,,1262,Hydrography and Nautical Charting.,"Users are advised to not use this generic vertical datum but to define explicit realisations of ISLW by specifying location and epoch, for instance ""ISLW at xxx during yyyy-yyyy"".","IHO Dictionary, S-32, 5th Edition, 2427.",OGP,"2012/08/10",2011.047,0,
1086,Mean Lower Low Water Spring Tides,vertical,The average height of the lower low water spring tides at a place.,,,,1262,Hydrography and Nautical Charting.,"Users are advised to not use this generic vertical datum but to define explicit realisations of MLLWS by specifying location and epoch, for instance ""MLLWS at xxx during yyyy-yyyy"".","IHO Dictionary, S-32, 5th Edition, 3146.",OGP,"2012/08/10",2011.047,0,
1087,Mean Low Water Spring Tides,vertical,The average height of the low waters of spring tides.,,,,1262,Hydrography and Nautical Charting.,"Users are advised to not use this generic vertical datum but to define explicit realisations of MLWS by specifying location and epoch, for instance ""MLWS at xxx during yyyy-yyyy"".","IHO Dictionary, S-32, 5th Edition, 3150.",OGP,"2012/08/10",2011.047,0,
1088,Mean High Water Spring Tides,vertical,The average height of the high waters of spring tides.,,,,1262,Hydrography and Nautical Charting.,"Users are advised to not use this generic vertical datum but to define explicit realisations of MHWS by specifying location and epoch, for instance ""MHWS at xxx during yyyy-yyyy"".","IHO Dictionary, S-32, 5th Edition, 3144.",OGP,"2012/08/10",2011.047,0,
