"DATUM_CODE","DATUM_NAME","DATUM_TYPE","ORIGIN_DESCRIPTION","REALIZATION_EPOCH","ELLIPSOID_CODE","PRIME_MERIDIAN_CODE","AREA_OF_USE_CODE","DATUM_SCOPE","REMARKS","INFORMATION_SOURCE","DATA_SOURCE","REVISION_DATE","CHANGE_ID","DEPRECATED","ESRI_DATUM_NAME"
6638,Saint Pierre et Miquelon 1950,geodetic,,1950,7008,8901,3299,"Geodetic survey, cadastre, topographic mapping, engineering survey.","Replaced by RGSPM06 (datum code 1038).",IGN Paris.,OGP,"2011/01/25",2006.060 2009.072 2011.004,0,"D_Saint_Pierre_et_Miquelon_1950"
6639,MOP78,geodetic,,1978,7022,8901,2815,"Geodetic survey, cadastre, topographic mapping, engineering survey.",,IGN Paris.,OGP,"2002/11/29",,0,"D_MOP78"
6640,Reseau de Reference des Antilles Francaises 1991,geodetic,WGS 84 coordinates of a single station determined during the 1988 Tango mission.,1991,7030,8901,2824,"Geodetic survey, cadastre, topographic mapping, engineering survey.","Replaces Fort Marigot and Sainte Anne (datum codes 6621-22) in Guadeloupe and Fort Desaix (datum code 6625) in Martinique.",IGN Paris.,OGP,"2004/03/26",2004.200 2009.073,1,
6641,IGN53 Mare,geodetic,South-east end of the La Roche base.,1953,7022,8901,2819,"Geodetic survey, cadastre, topographic mapping, engineering survey.",,"Service Topographique de la Nouvelle Caledonie, Direction des Infrastructures, de la Topografie et des Transports Terrestres. www.dittt.gouv.nc",OGP,"2006/07/21",2006.620,0,"D_IGN53_Mare"
6642,ST84 Ile des Pins,geodetic,"Fundamental point: Pic Nga.",1984,7022,8901,2820,"Geodetic survey, cadastre, topographic mapping, engineering survey.",,"Service Topographique de la Nouvelle Caledonie, Direction des Infrastructures, de la Topografie et des Transports Terrestres. www.dittt.gouv.nc",OGP,"2006/07/21",2006.620,0,"D_ST84_Ile_des_Pins"
6643,ST71 Belep,geodetic,,1971,7022,8901,2821,"Geodetic survey, cadastre, topographic mapping, engineering survey.",,Service Topographique de la Nouvelle Caledonie.,OGP,"2002/11/29",,0,"D_ST71_Belep"
6644,NEA74 Noumea,geodetic,Noumea old signal station.,1974,7022,8901,2823,"Geodetic survey, cadastre, topographic mapping, engineering survey.",,"Service Topographique de la Nouvelle Caledonie, Direction des Infrastructures, de la Topografie et des Transports Terrestres. www.dittt.gouv.nc",OGP,"2006/07/21",2006.620,0,"D_NEA74_Noumea"
6645,Reseau Geodesique Nouvelle Caledonie 1991,geodetic,ITRF90 at epoch 1989.0,1989,7022,8901,1174,"Geodetic survey, cadastre, topographic mapping, engineering survey.",,Service Topographique de la Nouvelle Caledonie.,OGP,"2002/11/29",,1,"D_RGNC_1991"
6646,Grand Comoros,geodetic,"Fundamental point: M'Tsaoueni.  Latitude: 11°28'32.200""S, longitude: 43°15'42.315""E (of Greenwich).",,7022,8901,2807,"Geodetic survey, cadastre, topographic mapping, engineering survey.",,IGN Paris.,OGP,"2008/06/24",2008.045,0,"D_Grand_Comoros"
6647,International Terrestrial Reference Frame 1988,geodetic,"Origin at geocentre, orientated to the BIH Terrestrial System at epoch 1984.0. Datum defined by a set of 3-dimensional Cartesian station coordinates (SCS).",1988,7019,8901,1262,Geodesy.,"Realisation of the IERS Terrestrial Reference System (ITRS) at epoch 1988.0. Replaced by ITRF89 (code 6648).","International Earth Rotation Service (IERS) Annual Report for 1988. Also IGN Paris http://lareg.ensg.ign.fr/ITRF",OGP,"2006/10/13",2006.770 2006.892,0,
6648,International Terrestrial Reference Frame 1989,geodetic,"Origin at geocentre, orientated to the BIH Terrestrial System at epoch 1984.0. Datum defined by a set of 3-dimensional Cartesian station coordinates (SCS).",1989,7019,8901,1262,Geodesy.,"Realisation of the IERS Terrestrial Reference System (ITRS) at epoch 1989.0. Replaces ITRF88 (code 6647). Replaced by ITRF90 (code 6649).","International Earth Rotation Service (IERS) Technical Note No. 6. Also IGN Paris http://lareg.ensg.ign.fr/ITRF",OGP,"2006/10/13",2006.770 2006.892,0,
6649,International Terrestrial Reference Frame 1990,geodetic,"Origin at geocentre, orientated to the BIH Terrestrial System at epoch 1984.0. Datum defined by a set of 3-dimensional Cartesian station coordinates (SCS).",1990,7019,8901,1262,Geodesy.,"Realisation of the IERS Terrestrial Reference System (ITRS) at epoch 1990.0. Replaces ITRF89 (code 6648). Replaced by ITRF91 (code 6650).","International Earth Rotation Service (IERS) Technical Note No. 9. Also IGN Paris http://lareg.ensg.ign.fr/ITRF",OGP,"2006/10/13",2006.770 2006.892,0,
6650,International Terrestrial Reference Frame 1991,geodetic,"Origin at geocentre, orientated to the BIH Terrestrial System at epoch 1984.0. Datum defined by a set of 3-dimensional Cartesian station coordinates (SCS).",1991,7019,8901,1262,Geodesy.,"Realisation of the IERS Terrestrial Reference System (ITRS) at epoch 1991.0. Replaces ITRF90 (code 6649). Replaced by ITRF92 (code 6651).","International Earth Rotation Service (IERS) Technical Note No. 12. Also IGN Paris http://lareg.ensg.ign.fr/ITRF",OGP,"2006/10/13",2006.770 2006.892,0,
6651,International Terrestrial Reference Frame 1992,geodetic,"Origin at geocentre, orientated to the BIH Terrestrial System at epoch 1984.0. Datum defined by a set of 3-dimensional Cartesian station coordinates (SCS).",1992,7019,8901,1262,Geodesy.,"Realisation of the IERS Terrestrial Reference System (ITRS) at epoch 1992.0. Replaces ITRF91 (code 6650). Replaced by ITRF93 (code 6652).","International Earth Rotation Service (IERS) Technical Note No. 15. Also IGN Paris http://lareg.ensg.ign.fr/ITRF",OGP,"2006/10/13",2006.770 2006.892,0,
6652,International Terrestrial Reference Frame 1993,geodetic,"Origin at geocentre, orientated to the BIH Terrestrial System at epoch 1984.0. Datum defined by a set of 3-dimensional Cartesian station coordinates (SCS).",1993,7019,8901,1262,Geodesy.,"Realisation of the IERS Terrestrial Reference System (ITRS) at epoch 1993.0. Replaces ITRF92 (code 6651). Replaced by ITRF94 (code 6653).","International Earth Rotation Service (IERS) Technical Note No. 18. Also IGN Paris http://lareg.ensg.ign.fr/ITRF",OGP,"2006/10/13",2006.770 2006.892,0,
6653,International Terrestrial Reference Frame 1994,geodetic,"Origin at geocentre, orientated to the BIH Terrestrial System at epoch 1984.0. Datum defined by a set of 3-dimensional Cartesian station coordinates (SCS).",1994,7019,8901,1262,Geodesy.,"Realisation of the IERS Terrestrial Reference System (ITRS) at epoch 1994.0. Replaces ITRF93 (code 6652). Replaced by ITRF96 (code 6654).","International Earth Rotation Service (IERS) Technical Note No. 20. Also IGN Paris http://lareg.ensg.ign.fr/ITRF",OGP,"2006/10/13",2006.770 2006.892,0,
6654,International Terrestrial Reference Frame 1996,geodetic,"Origin at geocentre, orientated to the BIH Terrestrial System at epoch 1984.0. Datum defined by a set of 3-dimensional Cartesian station coordinates (SCS).",1996,7019,8901,1262,Geodesy.,"Realisation of the IERS Terrestrial Reference System (ITRS) at epoch 1996.0. Replaces ITRF94 (code 6653). Replaced by ITRF97 (code 6655).","International Earth Rotation Service (IERS) Technical Note No. 24. Also IGN Paris http://lareg.ensg.ign.fr/ITRF",OGP,"2006/10/13",2006.770 2006.892,0,
6655,International Terrestrial Reference Frame 1997,geodetic,"Origin at geocentre, orientated to the BIH Terrestrial System at epoch 1984.0. Datum defined by a set of 3-dimensional Cartesian station coordinates (SCS).",1997,7019,8901,1262,Geodesy.,"Realisation of the IERS Terrestrial Reference System (ITRS) at epoch 1997.0. Replaces ITRF96 (code 6654). Replaced by ITRF2000 (code 6656).","International Earth Rotation Service (IERS) Technical Note No. 27. Also IGN Paris http://lareg.ensg.ign.fr/ITRF",OGP,"2006/10/13",2006.770 2006.892,0,
6656,International Terrestrial Reference Frame 2000,geodetic,"Origin at geocentre, orientated to the BIH Terrestrial System at epoch 1984.0. Datum defined by a set of 3-dimensional Cartesian station coordinates (SCS).",2000,7019,8901,1262,Geodesy.,"Realisation of the IERS Terrestrial Reference System (ITRS) at epoch 2000.0. Replaces ITRF97 (code 6655). Replaced by ITRF2005 (code 6896).","IGN Paris http://lareg.ensg.ign.fr/ITRF",OGP,"2011/02/25",2006.770 2006.892 2011.002,0,
6657,Reykjavik 1900,geodetic,"Fundamental point:  Latitude: 64°08'31.88""N, longitude: 21°55'51.15""W (of Greenwich).",1900,7051,8901,3262,Medium scale topographic mapping.,,"Landmaelingar Islands (National Survey of Iceland).",OGP,"2008/06/24",2008.045,0,"D_Reykjavik_1900"
6658,Hjorsey 1955,geodetic,"Fundamental point:  Latitude: 64°31'29.26""N, longitude: 22°22'05.84""W (of Greenwich).",1955,7022,8901,3262,"1/50,000 scale topographic mapping.",,"Landmaelingar Islands (National Survey of Iceland).",OGP,"2008/06/24",2008.045,0,"D_Hjorsey_1955"
6659,Islands Net 1993,geodetic,ITRF93 at epoch 1993.6.,1996,7019,8901,1120,"Geodetic survey, cadastre, topographic mapping, engineering survey.","Replaced by ISN2004 (datum code 1060).","Landmaelingar Islands (National Survey of Iceland).",OGP,"2010/11/12",2006.770 2010.101,0,"D_Islands_Network_1993"
6660,Helle 1954,geodetic,,1954,7022,8901,2869,"Geodetic survey, topographic mapping..",,Statens kartverk.,OGP,"2003/06/27",,0,"D_Helle_1954"
6661,Latvia 1992,geodetic,Constrained to 4 ETRS89 points in Latvia from the EUREF Baltic 1992 campaign.,1992,7019,8901,1139,"Topographic mapping, geodetic survey.",Densification of ETRS89 during the 1992 Baltic campaign.,"Latvijas Republikas Valsts zemes dienests (State Land Service of the Republic of Latvia) via EuroGeographics. http://crs.bkg.bund.de/crs-eu/",OGP,"2003/06/27",,0,"D_Latvia_1992"
6663,Porto Santo 1995,geodetic,SE Base on Porto Santo island. Origin and orientation constrained to those of the 1936 adjustment.,1995,7022,8901,1314,Topographic mapping.,"Classical and GPS observations. Replaces 1936 adjustment (datum code 6615). 
For Selvagens see Selvagem Grande (datum code 6616).","Instituto Geografico e Cadastral Lisbon; http://www.igeo.pt/",OGP,"2005/09/06",2005.460,0,"D_Porto_Santo_1995"
6664,Azores Oriental Islands 1995,geodetic,"Fundamental point: Forte de São Bras. Origin and orientation constrained to those of the 1940 adjustment.",1940,7022,8901,1345,Topographic mapping.,"Classical and GPS observations. Replaces 1940 adjustment (datum code 6184).","Instituto Geografico e Cadastral Lisbon; http://www.igeo.pt/",OGP,"2005/09/06",2005.460,0,"D_Azores_Oriental_Islands_1995"
6665,Azores Central Islands 1995,geodetic,"Fundamental point: Graciosa south west base. Origin and orientation constrained to those of the 1948 adjustment.",1948,7022,8901,1301,Topographic mapping.,"Classical and GPS observations. Replaces 1948 adjustment (datum code 6183).","Instituto Geografico e Cadastral Lisbon; http://www.igeo.pt/",OGP,"2005/09/06",2005.460,0,"D_Azores_Central_Islands_1995"
6666,Lisbon 1890,geodetic,"Fundamental point: Castelo Sao Jorge, Lisbon. Latitude: 38°42'43.631""N, longitude: 9°07'54.862""W of Greenwich.",1937,7004,8901,1294,Topographic mapping.,"Replaced by Lisbon 1937 adjustment (which uses International 1924 ellipsoid).","Instituto Geografico e Cadastral Lisbon http://www.igeo.pt",OGP,"2008/06/24",2003.361 2008.045,0,"D_Lisbon_1890"
6667,Iraq-Kuwait Boundary Datum 1992,geodetic,Four stations established between September and December 1991 determined by GPS and Doppler observations.,1992,7030,8901,2876,International boundary demarcation,,"United Nations Iraq-Kuwait Boundary Demarcation Commission, Final Report, May 1993.",OGP,"2003/09/01",,0,"D_Iraq_Kuwait_Boundary_1992"
6668,European Datum 1979,geodetic,"Fundamental point: Potsdam (Helmert Tower). Latitude: 52°22'51.4456""N, longitude: 13°03'58.9283""E (of Greenwich).",1979,7022,8901,1297,Scientific network.,Replaced by 1987 adjustment.,,OGP,"2008/06/24",2008.045,0,"D_European_1979"
6670,Istituto Geografico Militaire 1995,geodetic,Network of 1296 points observed 1992-1995 and adjusted in 1996 constrained to 9 ETRS89 points. Densification of ETRS89 in Italy.,1995,7030,8901,3343,Geodetic survey and scientific study.,"Replaced by RDN2008 (datum code 1132) from 2011-11-10.",ENI,OGP,"2014/01/27",2011.004 2014.002,0,"D_IGM_1995"
6671,Voirol 1879,geodetic,"Fundamental point: Voirol. Latitude: 36°45'08.199""N, longitude: 3°02'49.435""E (of Greenwich). Uses RGS (and old IGN) value of 2°20'13.95""for Greenwich-Paris meridian difference.",1879,7011,8901,1365,Topographic mapping.,"Replaces Voirol 1875 (code 6304).",IGN Paris,OGP,"2008/06/24",2008.045,0,"D_Voirol_1879"
6672,Chatham Islands Datum 1971,geodetic,,1971,7022,8901,2889,"Geodetic survey, topographic mapping, engineering survey.","Replaced by Chatham Islands Datum 1979 (code 6673).","Office of Surveyor General (OSG) Technical Report 14, June 2001.",OGP,"2004/02/17",,0,"D_Chatham_Island_1971"
6673,Chatham Islands Datum 1979,geodetic,"Fundamental point: station Astro. Latitude: 43°57'23.60""S, longitude: 176°34'28.65""W (of Greenwich).",1979,7022,8901,2889,"Geodetic survey, topographic mapping, engineering survey.","Replaces Chatham Islands Datum 1971 (code 6672). Replaced by New Zealand Geodetic Datum 2000 (code 6167) from March 2000.","Office of Surveyor General (OSG) Technical Report 14, June 2001.",OGP,"2008/06/24",2008.045,0,"D_Chatham_Islands_1979"
6674,Sistema de Referencia Geocentrico para las AmericaS 2000,geodetic,ITRF2000 at epoch 2000.40.,2000,7019,8901,3418,Geodetic survey.,"Realised by a frame of 184 stations observed in 2000 and adjusted in the ITRF2000. Includes ties to tide gauges. Replaces SIRGAS 1995 system for South America; expands SIRGAS to Central America.  Name changed in 2001 for use in all of Latin America.","IBGE Brazil,  http://www1.ibge.gov.br/",OGP,"2011/07/27",2005.460 2005.830 2006.465 2006.770 2009.087 2010.090 2011.053,0,"D_SIRGAS_2000"
6675,Guam 1963,geodetic,"Fundamental point: Tagcha. Latitude: 13°22'38.49""N, longitude: 144°45'51.56""E (of Greenwich).",1963,7008,8901,3255,Topographic mapping.,"Replaced by NAD83(HARN)","US National Geospatial Intelligence Agency (NGA). http://earth-info.nga.mil/",OGP,"2008/06/24",2005.460 2008.045,0,"D_Guam_1963"
6676,Vientiane 1982,geodetic,"Fundamental point: Vientiane (Nongteng) Astro Pillar. Latitude: 18°01'31.6301""N, longitude: 102°30'56.6999""E (of Greenwich).",1982,7024,8901,1138,Topographic mapping.,Replaced by Lao 1993.,National Geographic Department,OGP,"2008/06/24",2008.045,0,"D_Vientiane_1982"
6677,Lao 1993,geodetic,"Fundamental point: Lao 1982 coordinates of Pakxa pillar. Latitude: 18°23'57.0056""N, longitude: 103°38'41.8020""E (of Greenwich). Orientation parallel with WGS 84.",1993,7024,8901,1138,Topographic mapping.,Replaces Vientiane 1982. Replaced by Lao 1997,National Geographic Department,OGP,"2008/06/24",2008.045,0,"D_Lao_1993"
6678,Lao National Datum 1997,geodetic,"Fundamental point: Vientiane (Nongteng) Astro Pillar. Latitude: 18°01'31.3480""N, longitude: 102°30'57.1376""E (of Greenwich).",1997,7024,8901,1138,"Cadastre, topographic mapping, engineering survey.",Replaces Lao 1993.,National Geographic Department,OGP,"2008/06/24",2008.045,0,"D_Lao_National_Datum_1997"
6679,Jouik 1961,geodetic,,1961,7012,8901,2967,Hydrographic charting.,"Replaced by Mauritania 1999 (datum code 6702).",Woodside,OGP,"2006/06/12",2006.440,0,"D_Jouik_1961"
6680,Nouakchott 1965,geodetic,Nouakchott astronomical point.,1965,7012,8901,2968,Topographic survey.,"Triangulation limited to environs of Nouakchott. Extended in 1982 by satellite translocation from a single station ""Ruines"" to support Syledis chain for offshore operations. Replaced by Mauritania 1999 (datum code 6602).",IGN Paris and various industry sources.,OGP,"2006/06/12",2006.440,0,"D_Nouakchott_1965"
6681,Mauritania 1999,geodetic,,1999,7012,8901,1157,"Minerals management, topographic mapping.","A network of 36 GPS stations tied to ITRF96, 8 of which are IGN astronomic points.",Woodside,OGP,"2004/10/14",,1,"D_Mauritania_1999"
6682,Gulshan 303,geodetic,"Gulshan garden, Dhaka.",1995,7015,8901,1041,"Geodetic survey, cadastre, topographic mapping, engineering survey.","Network of more than 140 control points observed and adjusted in 1995 by Japan International Cooperation Agency (JICA).",Survey of Bangladesh via IGN Paris and Tullow Oil.,OGP,"2006/06/22",2006.470,0,"D_Gulshan_303"
6683,Philippine Reference System 1992,geodetic,"Fundamental point: Balacan. Latitude: 13°33'41.000""N, longitude: 121°52'03.000""E (of Greenwich), geoid-ellipsoid separation 0.34m.",1992,7008,8901,1190,"Geodetic survey, cadastre, topographic mapping, engineering survey.","Replaces Luzon 1911 datum (code 6253).","National Mapping and Resource Information Authority, Coast and Geodetic Survey Department.",OGP,"2008/06/24",2008.045,0,"D_Philippine_Reference_System_1992"
6684,Gan 1970,geodetic,,1970,7022,8901,3274,Topographic mapping.,"In some references incorrectly named ""Gandajika 1970"". See datum code 6685.",Various industry sources.,OGP,"2005/04/14",,0,"D_Gan_1970"
6685,Gandajika,geodetic,Gandajika base.,1953,7022,8901,1259,Topographic mapping.,In some references incorrectly attributed to the Maldives. See datum code 6684.,Various industry sources.,OGP,"2005/04/14",,1,
6686,Marco Geocentrico Nacional de Referencia,geodetic,"ITRF94 at epoch 1995.4.  Bogota observatory coordinates: Latitude: 4°35'46.3215""N, longitude: 74°04'39.0285""W (of Greenwich).",2004,7019,8901,1070,Geodetic survey.,"Densification of SIRGAS 1995 within Colombia. Replaces Bogota 1975 (datum code 6218).","Instituto Geografico Agustin Codazzi (IGAC) publication ""Aspectos prácticos de la adopción del Marco Geocéntrico Nacional de Referencia MAGNA-SIRGAS como datum oficial de Colombia"". http://www.igac.gov.co/MAGNAWEB/DocumentosMAGNA.htm",OGP,"2011/01/25",2006.770 2007.060 2008.045 2011.004,0,"D_MAGNA"
6687,Reseau Geodesique de la Polynesie Francaise,geodetic,"ITRF92 at epoch 1993.0. Densification by GPS of the Reference Network of French Polynesia, a coordinate set of 13 stations determined through DORIS observations.",1993,7019,8901,1098,Geodetic survey.,"Replaces Tahaa 54 (datum code 6629), IGN 63 Hiva Oa (6689), IGN 72 Nuku Hiva (6630), Maupiti 83 (6692), MHEFO 55 (6688), Moorea 87 (6691) and Tahiti 79 (6690).","Gouvernement de la Polynésie Française, Service  de l'Urbanisme, Section topographie. Also www.shom.fr, technical report 002/199.",OGP,"2006/08/18",2006.770,0,"D_Reseau_Geodesique_de_la_Polynesie_Francaise"
6688,Fatu Iva 72,geodetic,"Fundamental point: Latitude: 9°25'58.00""S, longitude: 138°55'06.25""W (of Greenwich).",1972,7022,8901,3133,Hydrographic and topographic survey.,"Recomputed by IGN in 1972 using origin and observations of 1953-1955 Mission Hydrographique des Establissements Francais d'Oceanie (MHEFO 55). Replaced by RGPF (datum code 6687).","Gouvernement de la Polynésie Française, Service  de l'Urbanisme, Section topographie.",OGP,"2008/06/24",2008.045,0,"D_Fatu_Iva_1972"
6689,IGN63 Hiva Oa,geodetic,"Fundamental point: Atuona. Latitude: 9°48'27.20""S, longitude: 139°02'15.45""W (of Greenwich).",1963,7022,8901,3130,Hydrographic and topographic survey.,"Replaced by RGPF (datum code 6687).","Gouvernement de la Polynésie Française, Service  de l'Urbanisme, Section topographie.",OGP,"2008/06/24",2008.045,0,"D_IGN63_Hiva_Oa"
6690,Tahiti 79,geodetic,"Fundamental point: Tahiti North Base. Latitude: 17°38'10.0""S, longitude: 149°36'57.8""W (of Greenwich).",1979,7022,8901,3124,Hydrographic and topographic survey.,"Replaces Tahiti 52 (datum code 6628) in Tahiti. Replaced by RGPF (datum code 6687).","Gouvernement de la Polynésie Française, Service  de l'Urbanisme, Section topographie.",OGP,"2008/06/24",2008.045,0,"D_Tahiti_1979"
6691,Moorea 87,geodetic,Two stations on Tahiti whose coordinates from the Tahiti 1979 adjustment were held fixed.,1987,7022,8901,3125,Hydrographic and topographic survey.,"Replaces Tahiti 52 (datum code 6628) in Moorea. Replaced by RGPF (datum code 6687).","Gouvernement de la Polynésie Française, Service  de l'Urbanisme, Section topographie.",OGP,"2005/08/12",,0,"D_Moorea_1987"
6692,Maupiti 83,geodetic,"Fundamental point: Pitiahe South Base. Latitude: 16°28'28.942""S, longitude: 152°14'55.059""W (of Greenwich).",1983,7022,8901,3126,Hydrographic and topographic survey.,"Replaced by RGPF (datum code 6687).","Gouvernement de la Polynésie Française, Service  de l'Urbanisme, Section topographie.",OGP,"2008/06/24",2008.045,0,"D_Maupiti_1983"
6693,Nakhl-e Ghanem,geodetic,"Coordinates of two stations determined with respect to ITRF 2000 at epoch 2005.2: BMT1 latitude 27°42'09.8417""N, longitude 52°12'11.0362""E (of Greenwich); Total1 latitude 27°31'03.8896""N, longitude 52°36'13.1312""E (of Greenwich).",2005,7030,8901,2362,Engineering survey for onshore facilities for South Pars phase 11 and Pars LNG.,,Total,OGP,"2008/06/24",2006.770 2008.045,0,"D_Nakhl-e_Ghanem"
6694,Posiciones Geodesicas Argentinas 1994,geodetic,"A geodetic network of 127 high accuracy surveyed points based on WGS 84 that define the National Geodetic System (Sistema Geodésico Nacional).",1994,7030,8901,1033,"Topographic mapping, geodetic survey.","Technically, but not legally, replaced by POSGAR 98 (code 6190) until May 2009, when POSGAR 2007 was officially accepted and officially replaced POSGAR 94.","Instituto Geográfico Militar de la República Argentina, http://www.igm.gov.ar",OGP,"2011/03/28",2008.052 2009.028,0,"D_POSGAR_1994"
6695,Katanga 1955,geodetic,"Fundamental point: Tshinsenda A. Latitude: 12°30'31.568""S, longitude: 28°01'02.971""E (of Greenwich).",1955,7008,8901,3147,"Cadastre, topographic mapping, engineering survey.",Replaces earlier adjustments.,"Clifford J. Mugnier, in Photogrammetric Engineering and Remote Sensing, June 2005.",OGP,"2009/06/02",2008.045 2009.011,0,"D_Katanga_1955"
6696,Kasai 1953,geodetic,"Two stations of the Katanga triangulation with ellipsoid change applied: Kabila, latitude 6°58'34.023""S, longitude 23°50'24.028""E (of Greenwich); and Gandajika NW base, latitude 6°45'01.057""S, longitude 23°57'03.038""E (of Greenwich).",1955,7012,8901,3148,"Cadastre, topographic mapping, engineering survey.",Replaced by IGC 1962 Arc of the 6th Parallel South.,Institute Geographique du Congo,OGP,"2008/06/24",2008.045,0,"D_Kasai_1953"
6697,IGC 1962 Arc of the 6th Parallel South,geodetic,"Coordinates of 3 stations determined with respect to Arc 1950: Mulungu 4°47'39.2325""S, 29°59'37.5864""E; Nyakawembe 4°14'57.3618""S, 29°42'52.8032""E; Kavula 4°35'15.8634""S, 29°41'14.2693""E (all longitude w.r.t. Greenwich).",1962,7012,8901,3149,"Geodetic survey, cadastre, topographic mapping, engineering survey.",,Institute Geographique du Congo,OGP,"2008/06/24",2006.721 2008.045,0,"D_IGC_1962_Arc_of_the_6th_Parallel_South"
6698,IGN 1962 Kerguelen,geodetic,K0 1949.,1949,7022,8901,2816,"Geodetic survey, cadastre, topographic mapping, engineering survey.",,IGN Paris.,OGP,"2005/11/23",,0,"D_Kerguelen_Island_1949"
6699,Le Pouce 1934,geodetic,"Fundamental point: Le Pouce. Latitude: 20°11'42.25""S, longitude: 57°31'18.58""E (of Greenwich).",1934,7012,8901,3209,"Geodetic survey, cadastre, topographic mapping, engineering survey.",,"Cartography Section, Ministry of Housing and Land.",OGP,"2008/06/24",2008.045,0,"D_Le_Pouce_1934"
6700,IGN Astro 1960,geodetic,Realised through a set of independent astronomically-positioned points.,1960,7012,8901,3277,Small scale topographic mapping.,"Observed during 1959-1960. Independent points not connected through a network. Relative accuracy estimated at 50-100m. Replaced by Mauritania 1999 (datum code 6702).","Ministry of Works and Transport, Topography and Cartography Directive.",OGP,"2012/01/05",2006.440 2012.001,0,"D_IGN_Astro_1960"
6701,Institut Geographique du Congo Belge 1955,geodetic,"Fundamental point: Yella east base. Latitude: 6°00'53.139""S, longitude: 12°58'29.287""E (of Greenwich).",1955,7012,8901,3171,"Cadastre, topographic mapping, engineering survey.","Replaced by IGC 1962 Arc of the 6th Parallel South, except for oil industry activities.",Institut Geographique du Congo Belge.,OGP,"2008/06/24",2008.045,0,"D_Institut_Geographique_du_Congo_Belge_1955"
6702,Mauritania 1999,geodetic,ITRF96 at epoch 1997.0,1999,7019,8901,1157,Geodesy.,"A network of 36 GPS stations tied to ITRF96, 8 of which are IGN 1962 astronomic points.","Ministry of Works and Transport, Topography and Cartography Directive.",OGP,"2006/08/18",2006.770,0,"D_Mauritania_1999"
6703,Missao Hidrografico Angola y Sao Tome 1951,geodetic,Extension of Camacupa datum into Cabinda.,1951,7012,8901,1318,Coastal hydrography.,"A variation of this datum has been adopted by the oil industry but incorrectly using the International 1924 ellipsoid and not tied to the official Portuguese triangulation - see Mhast (onshore) and Mhast (offshore) (codes 6704 and 6705).",Various industry sources.,OGP,"2006/01/03",,0,"D_Mhast_1951"
6704,"Mhast (onshore)",geodetic,Probably adopted a Mhast 1951 coordinate set but associated an incorrect ellipsoid with it.,,7022,8901,3179,"Oil industry exploration and production. From 1979, offshore use superseded by Mhast (offshore) (code 6705).","Adopted by oil industry with intention of being Mhast 1951 (code 6703) but incorrectly (for Mhast 1951) used the International 1924 ellipsoid. This datum differs by about 400 metres from the Portuguese Mhast 1951 and Camacupa datums.",ChevronTexaco.,OGP,"2006/01/03",,0,"D_Mhast_Onshore"
6705,"Mhast (offshore)",geodetic,"Fundamental point: Station Y at Malongo base camp. Latitude: 5°23'30.810""S, longitude: 12°12'01.590""E (of Greenwich).",1979,7022,8901,3180,Oil industry offshore exploration and production between 1979 and 1987.,"Origin coordinates determined by Transit single point position using 32 passes and transformed from WGS72BE using transformation code 15790. Differs from Mhast (onshore) by approximately 10m. Replaced in 1987 by Malongo 1987 (code 6259).",ChevronTexaco.,OGP,"2008/06/24",2008.045,0,"D_Mhast_Offshore"
