"DATUM_CODE","DATUM_NAME","DATUM_TYPE","ORIGIN_DESCRIPTION","REALIZATION_EPOCH","ELLIPSOID_CODE","PRIME_MERIDIAN_CODE","AREA_OF_USE_CODE","DATUM_SCOPE","REMARKS","INFORMATION_SOURCE","DATA_SOURCE","REVISION_DATE","CHANGE_ID","DEPRECATED","ESRI_DATUM_NAME"
5136,Hong Kong Chart Datum,vertical,"Approximates to Lowest Astronomic Tide level (LAT).",,,,3335,Hydrographic survey and charting.,"Chart datum is 0.15 metres below Hong Kong Principal Datum (code 5135) and 1.38m below MSL at Quarry Bay.","Survey and Mapping Office, Lands Department. Http://www.info.gov.hk/landsd/mapping/tindex.htm",OGP,"2009/06/02",2009.022,0,
5137,Yellow Sea 1985,vertical,20 years tide readings at Qingdao.,1985,,,3228,"Topographic mapping, geodetic survey.",Replaces Yellow Sea 1956 datum.,Guangdong Province Land Resource Information Centre,OGP,"2002/06/22",,0,
5138,"Ordnance Datum Newlyn (Orkney Isles)",vertical,Connected to Newlyn datum by triangulation from the British mainland.,,,,2793,"Topographic mapping, geodetic survey.",Considered as separate from Newlyn because the accuracy of the trigonometric connection across the Pentland Firth does not meet geodetic levelling specifications. Orthometric heights.,Ordnance Survey of Great Britain,OGP,"2004/06/16",2004.100,0,
5139,Fair Isle,vertical,,,,,2794,"Topographic mapping, geodetic survey.",Orthometric heights.,Ordnance Survey of Great Britain,OGP,"2002/09/19",,0,
5140,Lerwick,vertical,,,,,2795,"Topographic mapping, geodetic survey.",Orthometric heights.,Ordnance Survey of Great Britain,OGP,"2002/09/19",,0,
5141,Foula,vertical,,,,,2796,"Topographic mapping, geodetic survey.",Orthometric heights.,Ordnance Survey of Great Britain,OGP,"2002/09/19",,0,
5142,Sule Skerry,vertical,,,,,2797,"Topographic mapping, geodetic survey.",Orthometric heights.,Ordnance Survey of Great Britain,OGP,"2002/09/19",,0,
5143,North Rona,vertical,,,,,2798,"Topographic mapping, geodetic survey.",Orthometric heights.,Ordnance Survey of Great Britain,OGP,"2002/09/19",,0,
5144,Stornoway,vertical,,,,,2799,"Topographic mapping, geodetic survey.",Orthometric heights.,Ordnance Survey of Great Britain,OGP,"2002/09/19",,0,
5145,St Kilda,vertical,,,,,2800,"Topographic mapping, geodetic survey.",Orthometric heights.,Ordnance Survey of Great Britain,OGP,"2002/09/19",,0,
5146,Flannan Isles,vertical,,,,,2801,"Topographic mapping, geodetic survey.",Orthometric heights.,Ordnance Survey of Great Britain,OGP,"2006/01/16",2005.880,0,
5147,St Marys,vertical,,,,,2802,"Topographic mapping, geodetic survey.",Orthometric heights.,Ordnance Survey of Great Britain,OGP,"2002/09/19",,0,
5148,Douglas,vertical,,,,,2803,"Topographic mapping, geodetic survey.",Orthometric heights.,Ordnance Survey of Great Britain,OGP,"2002/09/19",,0,
5149,Fao,vertical,,,,,3390,"Topographic mapping, geodetic survey.","Established by Hunting Surveys for IPC. In Iran replaced by Bandar Abbas (code 5150). At time of record creation NIOC data in Ahwaz area still usually referenced to Fao. In Iraq replaced by Fao 1979 (code 1028).","National Iranian Oil Company (NIOC).",OGP,"2009/06/02",2009.003,0,
5150,Bandar Abbas,vertical,Average sea level at Bandar Abbas 1995-2001.,2001,,,3336,"Topographic mapping, geodetic survey.","Replaces Fao (datum code 5149) in Iran.",National Cartographic Centre of Iran,OGP,"2010/03/01",2010.014,0,
5151,Nivellement General de Nouvelle Caledonie,vertical,"Rivet AB01 established by SHOM (Service Hydrographique de la Marine)  in 1937 on the Quai des Volontaires in Noumea. Height i: 1.885 metre above mean sea level.",1969,,,2822,"Geodetic survey, topographic mapping, engineering survey.",Orthometric heights.,Service Topographique de la Nouvelle Caledonie.,OGP,"2004/03/15",2004.060,0,
5152,Poolbeg,vertical,"Low water mark of the spring tide on the 8 April 1837 at Poolbeg Lighthouse, Dublin.",1837,,,1305,Topographic mapping before 1956 in Northern Ireland and 1970 in the Republic of Ireland.,"Replaced by Belfast Lough and Malin Head (datum codes 5130-31).","""The Irish Grid - A Description of the Co-ordinate Reference System"" published by Ordnance Survey of Ireland, Dublin and Ordnance Survey of Northern Ireland, Belfast.",OGP,"2003/06/27",,0,
5153,Nivellement General Guyanais 1977,vertical,"Mean sea level 1936 at Cayenne. Origin = marker BM35 on stone on St Francois battery, Cayenne, with defined elevation of 1.64m above msl. NGG1977 height 0.00m is 1.96m above sounding datum defined at Cayenne in 1936 by SHM.",1977,,,3146,"Geodetic survey, topographic mapping, engineering survey.",Orthometric heights.,IGN Paris,OGP,"2008/09/17",2008.087,0,
5154,Martinique 1987,vertical,"Mean sea level 1939 at Fort de France. Origin = marker Nbc2 on rebuilt quay wall with defined elevation of 1.38m above msl. Martinique 1987 height 0.00m is 0.56m above SHOM sounding datum.",1987,,,3276,"Geodetic survey, topographic mapping, engineering survey.","Orthometric heights. Replaces Martinique 1955 (datum code 5192).",IGN Paris,OGP,"2008/09/19",2004.561 2008.087,0,
5155,Guadeloupe 1988,vertical,"Mean sea level July 1947 to June 1948 at Pointe-Fouillole (Pointe-à-Pitre harbour). Origin = marker GO-7 (formerly AO'-5) with defined height of 2.67m above msl adopted from 1951 value. Guadeloupe 1988 height 0.00m is 0.46m above 1984 sounding datum.",1988,,,2892,"Geodetic survey, topographic mapping, engineering survey.","Orthometric heights. Replaces Guadeloupe 1951 (datum code 5193).",IGN Paris,OGP,"2008/09/17",2004.561 2008.087,0,
5156,Reunion 1989,vertical,"Mean sea level during part of November 1949 at port of Saint-Pierre. Origin = marker AB-100 with defined elevation of 13.808m above msl.",1989,,,3337,"Geodetic survey, topographic mapping, engineering survey.",Orthometric heights. Replaces Reunion IGN58. Value of marker AB-100 retains height from 1958 adjustment.,IGN Paris,OGP,"2008/09/17",2004.561 2008.087,0,
5157,Auckland 1946,vertical,MSL at Auckland harbour 1909-1923.,1946,,,3764,"Geodetic survey, topographic mapping, engineering survey.",,"OSG Technical Report #10, February 2001.",OGP,"2011/01/25",2008.023 2011.005,0,
5158,Bluff 1955,vertical,MSL at Invercargill harbour over 8 years between 1918 and 1934.,1955,,,3801,"Geodetic survey, topographic mapping, engineering survey.",,"OSG Technical Report #10, February 2001.",OGP,"2011/01/25",2008.023 2011.005,0,
5159,Dunedin 1958,vertical,MSL at Dunedin harbour 1918-1937.,1958,,,3803,"Geodetic survey, topographic mapping, engineering survey.",,"OSG Technical Report #10, February 2001.",OGP,"2011/01/25",2008.023 2011.005,0,
5160,Gisborne 1926,vertical,MSL at Gisborne harbour 1926.,1926,,,3771,"Geodetic survey, topographic mapping, engineering survey.",,"OSG Technical Report #10, February 2001.",OGP,"2011/01/25",2008.023 2011.005,0,
5161,Lyttelton 1937,vertical,MSL at Lyttelton harbour over 9 years between 1918 and 1933.,1937,,,3804,"Geodetic survey, topographic mapping, engineering survey.",,"OSG Technical Report #10, February 2001.",OGP,"2011/01/25",2008.023 2011.005,0,
5162,Moturiki 1953,vertical,MSL at Moturiki Island February 1949 to December 1952.,1953,,,3768,"Geodetic survey, topographic mapping, engineering survey.",,"OSG Technical Report #10, February 2001.",OGP,"2011/01/25",2008.023 2011.005,0,
5163,Napier 1962,vertical,MSL at Napier harbour. Period of derivation unknown.,1962,,,3772,"Geodetic survey, topographic mapping, engineering survey.",,"OSG Technical Report #10, February 2001.",OGP,"2011/01/25",2008.023 2011.005,0,
5164,Nelson 1955,vertical,MSL at Nelson harbour 1939-1942.,1955,,,3802,"Geodetic survey, topographic mapping, engineering survey.",,"OSG Technical Report #10, February 2001.",OGP,"2011/01/25",2008.023 2011.005,0,
5165,One Tree Point 1964,vertical,MSL at Whangarei harbour 1960-1963.,1964,,,3762,"Geodetic survey, topographic mapping, engineering survey.",,"OSG Technical Report #10, February 2001.",OGP,"2011/01/25",2008.023 2011.005,0,
5166,Tararu 1952,vertical,MSL at Tararu Point 1922-1923.,1952,,,3818,"Geodetic survey, topographic mapping, engineering survey.",,"OSG Technical Report #10, February 2001.",OGP,"2011/01/25",2008.023 2011.005,0,
5167,Taranaki 1970,vertical,MSL at Taranaki harbour 1918-1921.,1970,,,3769,"Geodetic survey, topographic mapping, engineering survey.",,"OSG Technical Report #10, February 2001.",OGP,"2011/01/25",2008.023 2011.005,0,
5168,Wellington 1953,vertical,MSL at Wellington harbour 1909-1946.,1953,,,3773,"Geodetic survey, topographic mapping, engineering survey.",,"OSG Technical Report #10, February 2001.",OGP,"2011/01/25",2008.023 2011.005,0,
5169,"Waitangi (Chatham Island) 1959",vertical,MSL at Waitangi harbour collected in 1959.,1959,,,3894,"Geodetic survey, topographic mapping, engineering survey.",,"Interim Report GEO/T1/19/51 for LINZ by John Hannah, ""An Assessment of New Zealand's Height Systems and Options for a Future Height System"", January 2001.",OGP,"2011/06/20",2008.023 2011.048,0,
5170,Stewart Island 1977,vertical,MSL at 3-5 high and low tides at two different locations.,1977,,,3338,"Geodetic survey, topographic mapping, engineering survey.",,"Interim Report GEO/T1/19/51 for LINZ by John Hannah, ""An Assessment of New Zealand's Height Systems and Options for a Future Height System"", January 2001.",OGP,"2008/04/04",2008.023,0,
5171,EGM96 geoid,vertical,WGS 84 ellipsoid.,1996,,,1262,Geodesy.,,"NASA http://cddis.gsfc.nasa.gov/926/egm96/egm96.html",OGP,"2004/04/27",,0,
5172,Nivellement General du Luxembourg,vertical,"Reference point Wemperhardt defined as 528.030m above Normaal Amsterdams Peil (NAP). Datum at NAP is mean high tide in 1684. Network adjusted in 1995.",1995,,,1146,"Geodetic survey, topographic mapping, engineering survey.",Orthometric heights.,"Administration du Cadastre et de la Topographie. http://www.etat.lu/ACT",OGP,"2004/03/09",,0,
5173,Antalya,vertical,Mean sea Level at Antalya 1936-71.,,,,3322,"Geodetic survey, topographic mapping, engineering survey.",Orthometric heights.,"Eurogeographics, http://crs.bkg.bund.de/crs-eu/",OGP,"2004/11/26",2004.722,0,
5174,Norway Normal Null 1954,vertical,MSL defined by regression at 7 gauges with between 17 and 67 years observations.,1974,,,1352,"Geodetic survey, topographic mapping, engineering survey.",Includes initial NN1954 system and NNN1957 system. Former name retained. Normal-orthometric heights. Replaced by NN2000.,Statoil,OGP,"2012/12/17",2012.094,0,
5175,Durres,vertical,Mean Sea Level at Durres.,,,,3212,"Geodetic survey, topographic mapping, engineering survey.",Normal-orthometric heights.,"Eurogeographics, http://crs.bkg.bund.de/crs-eu/",OGP,"2004/03/09",,0,
5176,Gebrauchshohen ADRIA,vertical,Reference point Hutbiegl defined relative to mean sea level at Trieste in 1875.,,,,1037,"Geodetic survey, topographic mapping, engineering survey.",Normal-orthometric heights.,"Eurogeographics, http://crs.bkg.bund.de/crs-eu/",OGP,"2004/03/09",,0,
5177,National Vertical Network 1999,vertical,Reference point Ruse defined relative to mean sea level at Trieste in 1875.,1999,,,3307,"Geodetic survey, topographic mapping, engineering survey.",Normal-orthometric heights.,"Eurogeographics, http://crs.bkg.bund.de/crs-eu/",OGP,"2004/03/09",,0,
5178,Cascais,vertical,Mean Sea Level at Cascais 1938.,1938,,,1294,"Geodetic survey, topographic mapping, engineering survey.",Orthometric heights.,"Eurogeographics, http://crs.bkg.bund.de/crs-eu/",OGP,"2004/03/09",,0,
5179,Constanta,vertical,Mean Sea Level at Constanta.,,,,3295,"Geodetic survey, topographic mapping, engineering survey.",Normal-orthometric heights.,"Eurogeographics, http://crs.bkg.bund.de/evrs/Relations.html",OGP,"2004/03/09",,0,
5180,Alicante,vertical,Mean Sea Level at Alicante between 1870 and 1882.,,,,2366,"Geodetic survey, topographic mapping, engineering survey.",Orthometric heights.,"Eurogeographics, http://crs.bkg.bund.de/crs-eu/",OGP,"2004/03/09",,0,
5181,Deutsches Haupthoehennetz 1992,vertical,"Network adjusted in 1992. Geopotential number at reference point Wallenhorst defined as value from the UELN-73/86 adjustment. Datum at Normaal Amsterdams Peil (NAP) is mean high tide in 1684.",1992,,,3339,"Geodetic survey, topographic mapping, engineering survey.",Replaces DHHN85 in West Germany and SNN76 in East Germany. Uses Normal heights.,"Bundesamt für Kartographie und Geodäsie (BKG), http://crs.bkg.bund.de/crs-eu/",OGP,"2011/08/03",2011.071,0,
5182,Deutsches Haupthoehennetz 1985,vertical,"Network adjusted in 1985. Height of reference point Wallenhorst defined as value from 1928 adjustment. Datum at Normaal Amsterdams Peil (NAP) is mean high tide in 1684.",1985,,,2326,"Geodetic survey, topographic mapping, engineering survey.",Replaced by DHHN92. Uses Normal-orthometric heights.,"Eurogeographics, http://crs.bkg.bund.de/crs-eu/",OGP,"2011/08/03",2011.071,0,
5183,SNN76,vertical,Network adjusted in 1976. Height at reference point Hoppegarten defined as 1957 value from the UPLN adjustment. Datum at Kronstadt is mean sea level of Baltic in 1833.,1976,,,1343,"Geodetic survey, topographic mapping, engineering survey.",Uses Normal heights. Replaced by DHHN92.,"Eurogeographics, http://crs.bkg.bund.de/crs-eu/",OGP,"2004/03/09",,0,
5184,Baltic 1982,vertical,Network adjusted in 1982. Height at reference point Varna defined as 1958 value from the UPLN adjustment. Datum at Kronstadt is mean sea level of Baltic in 1833.,1982,,,3224,"Geodetic survey, topographic mapping, engineering survey.",Uses Normal heights.,"Eurogeographics, http://crs.bkg.bund.de/crs-eu/",OGP,"2004/03/09",,0,
5185,Baltic 1980,vertical,,,,,1119,"Geodetic survey, topographic mapping, engineering survey.",Uses Normal heights.,"Eurogeographics, http://crs.bkg.bund.de/crs-eu/",OGP,"2004/03/09",,0,
5186,Kuwait PWD,vertical,"Mean Low Low Water (MLLW) at Kuwait City.",,,,3267,Municipality and military purposes.,Approximately 1.03m below MSL.,Kuwait Oil Company.,OGP,"2004/06/16",,0,
5187,KOC Well Datum,vertical,,1937,,,3267,KOC exploration and field development subsurface work.,Approximately 3.22m above MSL.,Kuwait Oil Company.,OGP,"2004/06/16",,0,
5188,KOC Construction Datum,vertical,,1952,,,3267,KOC survey control and facilities engineering.,Approximately 1.52m below MSL. Created for the construction of the Mina al Ahmadi refinery.,Kuwait Oil Company.,OGP,"2004/06/16",,0,
5189,Nivellement General de la Corse 1948,vertical,Mean sea level at Ajaccio between 1912 and 1937.,1948,,,1327,"Geodetic survey, topographic mapping, engineering survey.","Replaced by IGN78 Corsica (datum 5120).",IGN Paris,OGP,"2004/10/14",,0,
5190,Danger 1950,vertical,Marker near tide gauge at port of Saint Pierre. Height is 1.26 metres above zero of tide gauge.,1950,,,3299,"Geodetic survey, topographic mapping, engineering survey.",,IGN Paris,OGP,"2004/10/14",,0,
5191,Mayotte 1950,vertical,Marker on Issoufali jetty at Dzaoudzi. Height is 2.18m above zero of tide gauge.,1950,,,3340,"Geodetic survey, topographic mapping, engineering survey.",,IGN Paris,OGP,"2004/10/14",,0,
5192,Martinique 1955,vertical,Mean sea level at Fort de France 1939. Marker DO-4-II on quay wall with elevation of 1.38m above msl.,1955,,,3276,"Geodetic survey, topographic mapping, engineering survey.","Orthometric heights. Replaced by Martinique 1987 (datum code 5154).",IGN Paris,OGP,"2008/09/17",2008.087,0,
5193,Guadeloupe 1951,vertical,"Mean sea level July 1947 to June 1948 at Pointe-Fouillole (Pointe-à-Pitre harbour). Origin = marker AO'-12 with height of 1.917m above msl.",1955,,,2892,"Geodetic survey, topographic mapping, engineering survey.","Orthometric heights. Replaced by Guadeloupe 1988 (datum code 5155). Guadeloupe 1951 height 0.00m is 0.629m above 1947-48 sounding datum.",IGN Paris,OGP,"2008/09/17",2008.087,0,
5194,Lagos 1955,vertical,"Mean sea level at Lagos, 1912-1928.",1955,,,3287,"Geodetic survey, topographic mapping, engineering survey.",,"Ebong et al, AVN International, 1991.",OGP,"2004/10/14",,0,
5195,Nivellement General de Polynesie Francaise,vertical,,,,,3134,"Geodetic survey, topographic mapping, engineering survey.",The collection of heterogeneous levelling networks throughout the Society Islands of French Polynesia.,"Gouvernement de la Polynésie Française, Service  de l'Urbanisme, Section topographie.",OGP,"2005/08/12",,0,
5196,IGN 1966,vertical,"Fundamental benchmark: RN501",1966,,,3124,"Geodetic survey, topographic mapping, engineering survey.",Included as part of NGPF - see datum code 5195.,"Gouvernement de la Polynésie Française, Service  de l'Urbanisme, Section topographie.",OGP,"2005/08/12",,0,
5197,Moorea SAU 1981,vertical,"Fundamental benchmark: RN225",1981,,,3125,"Geodetic survey, topographic mapping, engineering survey.",Included as part of NGPF - see datum code 5195.,"Gouvernement de la Polynésie Française, Service  de l'Urbanisme, Section topographie.",OGP,"2005/08/12",,0,
5198,Raiatea SAU 2001,vertical,"Fundamental benchmark: RN1",2001,,,3136,"Geodetic survey, topographic mapping, engineering survey.",Included as part of NGPF - see datum code 5195.,"Gouvernement de la Polynésie Française, Service  de l'Urbanisme, Section topographie.",OGP,"2005/08/12",,0,
5199,Maupiti SAU 2001,vertical,"Fundamental benchmark: RN11",2001,,,3126,"Geodetic survey, topographic mapping, engineering survey.",Included as part of NGPF - see datum code 5195.,"Gouvernement de la Polynésie Française, Service  de l'Urbanisme, Section topographie.",OGP,"2005/08/12",,0,
5200,Huahine SAU 2001,vertical,"Fundamental benchmark: SHOM B3",2001,,,3135,"Geodetic survey, topographic mapping, engineering survey.",Included as part of NGPF - see datum code 5195.,"Gouvernement de la Polynésie Française, Service  de l'Urbanisme, Section topographie.",OGP,"2005/08/12",,0,
5201,Tahaa SAU 2001,vertical,"Fundamental benchmark: RN16",2001,,,3138,"Geodetic survey, topographic mapping, engineering survey.",Included as part of NGPF - see datum code 5195.,"Gouvernement de la Polynésie Française, Service  de l'Urbanisme, Section topographie.",OGP,"2005/08/12",,0,
5202,Bora Bora SAU 2001,vertical,"Fundamental benchmark: Vaitape quay SHOM benchmark B.",2001,,,3137,"Geodetic survey, topographic mapping, engineering survey.",Included as part of NGPF - see datum code 5195.,"Gouvernement de la Polynésie Française, Service  de l'Urbanisme, Section topographie.",OGP,"2005/08/12",,0,
5203,EGM84 geoid,vertical,WGS 84 ellipsoid.,1984,,,1262,Geodesy.,,"US National Geospatial-Intelligence Agency (NGA); http://earth-info.nga.mil/GandG/",OGP,"2005/09/30",,0,
5204,International Great Lakes Datum 1955,vertical,"Mean water level 1941-1956 at Pointe-au-Père (Father's Point), Quebec. Benchmark 1248-G = 3.794m.",1955,,,3468,Hydrology.,Dynamic heights. Adopted in 1962. Replaced by IGLD 1985 in January 1992.,Coordinating Committee on Great Lakes Basic Hydraulic and Hydrologic Data,OGP,"2012/08/10",2011.047,0,
5205,International Great Lakes Datum 1985,vertical,"Mean water level 1970-1983 at Pointe-au-Pierre (Father's Point) and 1984-1988 at Rimouski, Quebec. Benchmark 1250-G = 6.273m.",1985,,,3468,Hydrology.,Dynamic heights. Replaces IGLD 1955 from January 1992.,Coordinating Committee on Great Lakes Basic Hydraulic and Hydrologic Data,OGP,"2012/08/10",2011.047,0,
5206,Dansk Vertikal Reference 1990,vertical,"Benchmark at Århus cathedral referenced to mean sea level determined during 1990 at 10 tide gauges: Esbjerg, Fredericia, Frederikshavn, Gedser, Hirtshals, Hornbæk, Korsør, København, Slipshavn and Århus.",,,,3237,Topographic mapping and engineering survey,Normal Orthometric heights.,"Kort & Matrikelstyrelsen",OGP,"2006/12/01",,0,
5207,Croatian Vertical Reference System 1971,vertical,"Mean sea level at five tide gauges in Dubrovnik, Split, Bakar, Rovinj and Kopar at epoch 1971.5",1971,,,3234,Geodesy.,"Replaces Trieste (datum code 1050).",State Geodetic Administration of the Republic of Croatia.,OGP,"2010/07/13",2008.043 2010.064,0,
5208,Rikets hojdsystem 2000,vertical,"Adjustment is referenced to mean high tide at Amsterdams Peil in 1684. To account for land level movements caused by isostatic rebound, heights are reduced to epoch 2000.0 using values computed from the RH 2000 LU (=NKG2005LU) uplift model.",2000,,,3313,"Topographic mapping, geodetic survey.","Realised through the third precise levelling network of 1979-2003. Adopted in 2005, replacing RH70. Uses Normal heights.",National Land Survey of Sweden,OGP,"2008/03/14",,0,
5209,Rikets hojdsystem 1900,vertical,"Adjustment is referenced to mean sea level at Slussen, Stockholm.",1900,,,3313,"Topographic mapping, engineering survey.",Realised through the first precise levelling network of 1886-1905. Replaced by RH70.,National Land Survey of Sweden,OGP,"2008/03/14",,0,
5210,IGN 1988 LS,vertical,"Mean sea level 1984 at Terre de Haut. Origin = marker O de -5 with defined height of 1.441m above msl. IGN 1988 LS height 0.00m is 0.46m above 1987 sounding datum; this approximately corresponds with msl at Pointe-à-Pitre (see datum code 5155, CRS 5757).",1988,,,2895,"Geodetic survey, topographic mapping, engineering survey.",Orthometric heights.,IGN Paris,OGP,"2008/09/17",,0,
5211,IGN 1988 MG,vertical,"Mean sea level 1987 at Grand-Bourg. Origin = marker M0-I with defined height of 0.832m above msl. IGN 1988 MG height 0.00m is 0.46m above 1987 sounding datum; this approximately corresponds with msl at Pointe-à-Pitre (see datum code 5155, CRS code 5757).",1988,,,2894,"Geodetic survey, topographic mapping, engineering survey.",Orthometric heights.,IGN Paris,OGP,"2008/09/17",,0,
5212,IGN 1992 LD,vertical,"Mean sea level at Pointe-à-Pitre. Origin = marker A with defined height of 0.792m above msl. IGN 1992 LD height 0.00m is 0.629m above sounding datum at Pointe-à-Pitre.",1992,,,2893,"Geodetic survey, topographic mapping, engineering survey.",Orthometric heights.,IGN Paris,OGP,"2008/09/17",,0,
5213,IGN 1988 SB,vertical,"Mean sea level 1988 at port of Gustavia. Origin = marker A.ef-2 with defined height of 0.621m above msl. IGN 1988 SB height 0.00m deduced to be 0.201m above mean sea level at Pointe-à-Pitre.",1988,,,2891,"Geodetic survey, topographic mapping, engineering survey.",Orthometric heights.,IGN Paris,OGP,"2008/09/17",,0,
5214,IGN 1988 SM,vertical,"Mean sea level 1949-1950 deduced at Fort Marigot. Origin = marker AS-13 with defined height of 6.990m above msl. IGN 1988 SM height 0.00m deduced to be 0.41m above sounding datum.",1988,,,2890,"Geodetic survey, topographic mapping, engineering survey.",Orthometric heights.,IGN Paris,OGP,"2008/09/17",,0,
5215,European Vertical Reference Frame 2007,vertical,"13 stations (to be completed)",2007,,,3594,Geodesy.,"Realised by geopotential numbers and Normal heights of the United European Levelling Network. Replaces EVRF2000 (datum code 5129).","European veritical data centre at Bundesamt für Kartographie und Geodäsie (BKG), Leipzig branch. http://crs.bkg.bund.de/evrs/",OGP,"2008/11/21",,0,
6001,"Not specified (based on Airy 1830 ellipsoid)",geodetic,,,7001,8901,1263,Not a valid datum.,Included for coordinate reference systems where datum is unknown.,OGP,OGP,"2000/05/03",1996.080 2000.420,0,"D_Airy_1830"
6002,"Not specified (based on Airy Modified 1849 ellipsoid)",geodetic,,,7002,8901,1263,Not a valid datum.,Included for coordinate reference systems where datum is unknown.,OGP,OGP,"2000/05/03",1996.080 2000.420,0,"D_Airy_Modified"
6003,"Not specified (based on Australian National Spheroid)",geodetic,,,7003,8901,1263,Not a valid datum.,Included for coordinate reference systems where datum is unknown.,OGP,OGP,"2000/05/03",1996.080 2000.420,0,"D_Australian"
6004,"Not specified (based on Bessel 1841 ellipsoid)",geodetic,,,7004,8901,1263,Not a valid datum.,Included for coordinate reference systems where datum is unknown.,OGP,OGP,"2000/05/03",1996.080 2000.420,0,"D_Bessel_1841"
6005,"Not specified (based on Bessel Modified ellipsoid)",geodetic,,,7005,8901,1263,Not a valid datum.,Included for coordinate reference systems where datum is unknown.,OGP,OGP,"2000/05/03",1996.080 2000.420,0,"D_Bessel_Modified"
6006,"Not specified (based on Bessel Namibia ellipsoid)",geodetic,,,7046,8901,1263,Not a valid datum.,Included for coordinate reference systems where datum is unknown.,OGP,OGP,"2001/01/21",1996.080 2000.420 2001.150,0,"D_Bessel_Namibia"
6007,"Not specified (based on Clarke 1858 ellipsoid)",geodetic,,,7007,8901,1263,Not a valid datum.,Included for coordinate reference systems where datum is unknown.,OGP,OGP,"2000/05/03",1996.080 2000.420,0,"D_Clarke_1858"
6008,"Not specified (based on Clarke 1866 ellipsoid)",geodetic,,,7008,8901,1263,Not a valid datum.,Included for coordinate reference systems where datum is unknown.,OGP,OGP,"2000/05/03",1996.080 2000.420,0,"D_Clarke_1866"
6009,"Not specified (based on Clarke 1866 Michigan ellipsoid)",geodetic,,,7009,8901,1263,Not a valid datum.,Included for coordinate reference systems where datum is unknown.,OGP,OGP,"2000/05/03",1996.080 2000.420 2013.020,1,"D_Clarke_1866_Michigan"
6010,"Not specified (based on Clarke 1880 (Benoit) ellipsoid)",geodetic,,,7010,8901,1263,Not a valid datum.,Included for coordinate reference systems where datum is unknown.,OGP,OGP,"2000/05/03",1996.080 2000.420,0,"D_Clarke_1880_Benoit"
6011,"Not specified (based on Clarke 1880 (IGN) ellipsoid)",geodetic,,,7011,8901,1263,Not a valid datum.,Included for coordinate reference systems where datum is unknown.,OGP,OGP,"2000/05/03",1996.080 2000.420,0,"D_Clarke_1880_IGN"
6012,"Not specified (based on Clarke 1880 (RGS) ellipsoid)",geodetic,,,7012,8901,1263,Not a valid datum.,Included for coordinate reference systems where datum is unknown.,OGP,OGP,"2000/05/03",1996.080 2000.420,0,"D_Clarke_1880_RGS"
6013,"Not specified (based on Clarke 1880 (Arc) ellipsoid)",geodetic,,,7013,8901,1263,Not a valid datum.,Included for coordinate reference systems where datum is unknown.,OGP,OGP,"2000/05/03",1996.080 2000.420,0,"D_Clarke_1880_Arc"
